113,Bernardeschi is latest to contract COVID-19 after Italy duty
113,Devdutt Padikkal joins RCB squad after testing negative for Covid-19
113,Pessina is eight player to contract Covid-19 after Italy duty
114,One killed as speeding SUV rams into cycle in Noida
114,Pedestrian killed by container in Jambhulwadi
114,"Rickshaw driver, accomplice arrested for molesting woman in Mumbai a month ago"
114,"SUV rams e-rickshaw, two injured"
114,"‘Distracted’ while driving, woman runs over elderly couple in Dwarka"
115,‘New Covid wave due to complacency’: Yogi Adityanath gets first shot of vaccine
115,‘Vaccine is our best hope’: Doc leads the way in battle against hesitancy
116,"Man accidentally steps on loose piece of wood, gets smacked on face"
116,‘Not funny Kevin!’: Human’s prank on doggo leaves it bamboozled
117,Mohali to get new mayor on April 8
117,PM Narendra Modi to interact with CMs on current Covid-19 situation on April 8
118,"Aakash Chopra picks ideal PBK XI for IPL 2021, leaves out"
118,Tom Moody explains why SRH bought ‘very effective' bowler at IPL 2021 auction
119,Karnataka imposes restrictions under Sec 144 in Bengaluru city limits
119,News updates from HT: Section 144 in Bengaluru city limits as virus cases rise
120,"'Health is happiness': MI's Hardik, Krunal, Lynn share tips on World Health Day"
121,"In SAD’s Ludhiana publicity blitz, Sr Badal is conspicuously missing"
121,"Mission 2022: Akhilesh criss-crosses state, covers 40 districts"
122,Kishwer responds to Kangana's fans who accuse her of 'bullying' actor
122,Varun and Natasha donate
123,"Covid-19 surge: Centre rushes 50 teams to Maharashtra, Chhattisgarh and Punjab"
123,Health minister to review Covid-19 situation with heads of 11 states today
123,"Mumbai civic body orders fire safety audit of all private, govt hospitals"
124,Neha Kakkar’s stunning lehenga look are the only blues accepted this Monday
124,"Vidya Balan slays perfect summer getaway look in a satin blouse, printed skirt"
125,Covid mutants multiply as scientists race to decode variations
125,Goa considers own lab to test Covid-19 strain due to long wait at Pune
126,Anita Hassanandani talks to baby Aaravv: 'Who’s gonna be two months in 2 days?
126,Madhuri Dixit shows off another stunning date night look
126,"Mira Rajput shares throwback pic with Pragya Kapoor, dubs them 'bump twins'"
127,Delhi govt orders its hospitals to run 1/3rd of vaccination centres 24*7
127,Delhi govt to create micro containment zones to check Covid-19 spread
127,IOA's Mehta issues fresh appeal to vaccinate Tokyo-bound athletes
127,Kejriwal urges PM Modi to expand coverage of Covid-19 vaccination drive
128,From farmer's family to CJI: Justice NV Ramana's life and career
128,Justice NV Ramana appointed as CJI
128,"Justice NV Ramana formally appointed as next CJI, to assume charge on April 24"
129,All three fronts in Wayanad exude confidence
129,Palayamkottai brings down Tirunelveli district’s poll percentage
130,BAI postpones domestic badminton tournaments in wake of rising COVID-19 cases
130,Madhya Pradesh suspends bus operations with Chhattisgarh till April 15
130,"School, college closure extended till April 10 in Chandigarh"
131,"'Change in thought process, social norms key for gender diversity at workplace'"
131,Harvard study praises UP Govt for its handling of migrant crisis during pandemic
132,PM Modi interacts with students in virtual edition of 'Pariksha Pe Charcha'
132,"Students of Classes 9, 11 to be promoted without exams"
132,Use free time to increase curiosity about productive things: PM Modi to students
133,"Local lockdowns, inflation, GDP growth: What RBI governor Shaktikanta Das said"
133,"Realtors welcome RBI policy, urge apex bank to boost liquidity in housing sector"
133,"Repo rate, reverse repo rate remain same, 'local lockdowns could hit demand'"
134,"Arjun asks fans to spot difference between his two pics, Janhvi has best reply"
134,"Eijaz crashes Pavitra’s live, says his ‘mouth is watering’ for kebabs she made"
134,"Janhvi goes on 'shaahi sawari' inside airport with her mask, face shield on"
134,"Tara drops sultry photo, boyfriend Aadar Jain says she gives him ‘fever’"
135,Madhuri Dixit dresses in co-ord bralette and pants for date night in Maldives
135,"Shraddha shares sunkissed pics from Maldives, brother offers a funny suggestion"
136,"Toddler meets dad after long time, oh-so-cute video may melt your heart"
136,Video featuring adorable doggo siblings are reminding netizens of theirs
137,"Confusion, fear, anger on day 1 of new restrictions for Pune’s traders, shop owners"
137,"Restriction Day 2 evokes protest from shop owners, traders in Pune"
138,"'Leg broken, but still fighting': Jaya Bachchan campaigns for Mamata Banerjee"
138,"Bengal Polls: PM Modi targets Mamata over appeal to Muslim voters, CM hits back"
138,"Mamata Banerjee's appeal to Muslims violated model code of conduct, says EC"
138,"Sonia appeals to kerala voters to bring UDF govt, ‘strengthen the Cong nationally’"
139,"2 days before IPL 2021 opener, RCB's Daniel Sams tests positive for Covid-19"
139,Coronavirus | RCB’s Daniel Sams tests positive
139,"MI players, support staff return Covid negative after More's positive test"
140,Recipe: Craving a healthy sweet treat? Try these blueberry protein cookies
140,Recipe: In the mood for a Mediterranean cuisine? Try Persian chicken kebabs
140,Recipe: Om nom nom your way through Tuesday with spinach and ‘ricotta’ ravioli
141,Around 70 including students test positive for Covid-19 at IIT-Jodhpur
141,"New coronavirus variant 'Eek' found in Japan, lowers vaccine protection"
142,"'It's about adapting to situation,' Gill says strike rate is 'kind of overrated"
142,Jofra Archer not impressed by Taslima Nasreen's remarks on Moeen Ali
143,"78.5 lakh voters, 205 candidates: West Bengal all set for phase 3 of polling"
143,Phase 3 of Bengal elections: 5 prominent candidates to keep an eye out for
143,"TMC bastions, big names in Phase 3 of West Bengal elections"
144,'Was cornered in TMC for resisting cut money culture...': Rajib Banerjee
144,"Centre trying to dominate with farm laws, DBT: Punjab CM"
145,Jordan bans news outlets from covering royal rift
145,Jordan's Prince Hamzah says he won't obey orders: Audio recording
145,US Supreme Court brings end to Donald Trump's 'moot' Twitter fight
146,100 armed cops leave for Punjab to bring Ansari back to UP jail
146,100-member UP Police team takes custody of Mukhtar Ansari
146,Gangster-turned-politician Mukhtar Ansari brought back to Banda jail from Punjab
146,Gangster-turned-politician Mukhtar Ansari's custody handed over to UP Police
146,Punjab hands over BSP legislator Mukhtar Ansari to UP Police
146,Uttar Pradesh takes over Mukhtar Ansari’s custody from Punjab
147,"Affluent pockets have high caseload, more hot spots"
147,Covid-19: India second country after US to record over 1 lakh daily cases
148,"Covid-19: Google letters social distance, wear face masks in new quirky doodle"
148,Japan fears Covid-19 variants are behind possible fourth wave
149,Billie Eilish kept her blonde hair transformation under wraps for months
149,Rahul Vaidya and Disha Parmar dress up in wedding finery but there is a twist
150,Ambulances to be used centrally for ferrying Covid patients
150,Goa seeks permission to vaccinate all tourism sector workers irrespective of age
151,Man booked for uploading woman’s pictures without consent
151,Mother kills 3-year-old daughter
152,Kremlin critic Alexei Navalny's supporters denied prison visit and detained
152,"Russia may be 'slowly killing' Alexei Navalny, says Amnesty International"
153,"Alderweireld, Aurier left out due to late return: Mourinho"
153,"Champions League: Eden Hazard not ready to face Liverpool, says Zinedine Zidane"
153,"Everton still in the hunt for European berth, says Ancelotti"
153,"PSG not out for revenge against Bayern, says boss Pochettino"
153,Tuchel seeks return of calm after Chelsea bust-up
154,"Jaishankar meets Russian counterpart in Delhi, discusses Putin's visit"
154,News updates from HT: Jaishankar meets Russian counterpart in Delhi
155,Full list of records & milestones Hardik Pandya can achieve in IPL 2021
155,IPL 2021: 5 lowest team totals in IPL history
155,T20 World Cup in India on track despite pandemic woes: ICC
156,'Being world No. 1 does not mean you can score 40-ball tons every time': Malan
156,'Seems to be a mid-table team': Aakash Chopra predicts RR's future in IPL 2021
156,Full list of records CSK captain MS Dhoni can achieve in IPL 2021
156,IPL 2021: Punjab Kings - Team profile and full squad
157,'Need for a lockdown': Gujarat HC tells state govt amid rising Covid-19 cases
157,"As new cases rise, police step up watch on Covid violators"
157,Covid: Gujarat imposes new curbs as HC says situation going ‘out of control’
157,Delhi announces night curfew. List of restrictions in other states
157,Delhi government imposes night curfew from 10pm to 5am till April 30
157,"Delhi mulls night curfew, PM Modi to meet CMs as wave surges"
157,Delhi’s test positivity rate past 5% mark after 124 days
157,Night curfew in Delhi: DM offices prepare as scramble for e-passes begin
157,Will I need an e-pass? Eateries will be open? Delhi night curfew FAQs answered
158,Gujarat government refutes Congress' Covid-19 pandemic mismanagement claims
158,India won't open Covid-19 vaccination for all. Official explains why
158,LIVE: Over 88 million Covid-19 vaccine doses administered in India so far
158,Over 79 million Covid-19 vaccine doses administered in India: Health ministry
159,India records highest single-day Covid-19 vaccine coverage yet
159,"Punjab records 72 Covid deaths in a day, highest this year"
160,Giving powers to housing society heads to tackle Covid gets mixed response in Pune
160,NCW chairperson discusses police's role in women safety with Rajasthan DGP
161,"B’luru logs over 3k new Covid cases, 18 deaths"
161,"News updates from HT: At 3,548 Covid-19 cases Delhi's daily tally dips slightly"
161,Resident bodies help govt implement Covid measures as cases surge
162,Cryptocurrency market cap hits record $2 trillion; Bitcoin's at $1.1 trillion
162,US disbursed over 150 million stimulus payments in Biden relief plan
163,"Fire at hardware shop in Gurugram, no casualty reported"
163,"Major fire breaks out Mumbai's Kurla, no injuries reported"
163,Militants open fire on security personnel in J&K's Shopian; no casualty reported
164,Covid-19: Noida admin asks residents to inform it about arrival of outsiders
164,Covid-19: Uttar Pradesh government sets rules for containment zones in Noida
165,FALSE: No truth to 45 people from Akshay Kumar’s Ram Setu crew testing Covid positive
165,IPL’s home test amid rising cases
166,"Kapil's fan wants to work with him, he says 'Mai to khud ghar pe baitha hun'"
166,Taarak Mehta Ka Ooltah Chashmah director reacts to fan’s request for new Dayaben
167,"LU, affiliated colleges closed till Apr 10 after 20 staff test positive"
167,NIELIT exam on Apr 11 amid corona spurt: LU in a fix
168,"Russian Olympic champions Silnov, Antyukh banned for doping"
168,Soccer-AFC bans Brazilian striker Jaja for four years over doping violation
169,Defamation case: Court likely to pronounce order on Kangana Ranaut’s plea today
169,Woman seeking FIR against Jharkhand CM in Bombay HC withdraws petition
170,Covid-19 second wave: HC asks authorities to ensure cent percent face masking
170,"With spike in cases, state government ropes in special teams for Ghaziabad, GB Nagar"
171,"Bollywood’s release calendar goes for a toss, yet again"
171,"Covid spell, spells bad days for Bollywood- again?"
171,Sooryavanshi release postponed indefinitely due to rise in COVID-19 cases
172,'Will win Bengal on one leg and Delhi on two': Mamata Banerjee
172,Sarbananda Sonowal confident of BJP-led alliance winning Assam assembly polls
173,"Beam from railway bridge falls on parked trucks, kills watchman in Delhi"
173,One killed as girder falls on parked trucks
173,UP man shot by Nepal cops dies in Lucknow hospital
174,"BCCI Apex Council meet agenda: Indian women's support staff, state T20 leagues"
174,Goa to belatedly implement new Motor Vehicle Act from May 1
175,AI can bring enormous changes in way we train and fight wars: IAF chief
175,"China capable of launching cyber-attacks against India, says CDS Gen Rawat"
176,Centre writes to Delhi govt on irregularities in Covid-19 vaccine beneficiaries
176,"Private schools tracking our social media accounts, allege parents"
177,IPL 2021: Who is RR's Jos Buttler's 'cute' workout companion? - WATCH
177,"Ludhiana nonagenarian shows the way, urges others to take the jab"
178,Co-Win’s error results in highest inoculation in a day in Noida
178,Covid-19 safety rules violated at New Delhi Railway Station
179,Anil Deshmukh moves Supreme Court against Bombay HC order directing CBI probe
179,CBI registers preliminary enquiry against Anil Deshmukh on HC order
179,"Deshmukh, Maha govt move SC against HC’s order for CBI probe"
179,Deshmukh’s exit: The start of Maharashtra Vikas Aghadi alliance’s troubles?
179,"EC notice to DMK's Udhayanidhi for remarks on Arun Jaitley, Sushma Swaraj"
179,"Maha CM accepts Deshmukh's resignation, Dilip Walse Patil takes charge"
179,"Maharashtra home minister Anil Deshmukh, facing corruption allegations, resigns"
179,Patil starts stint as Maharashtra home minister with a promise and appeal in SC
180,Gayle performs moonwalk on Michael Jackson’s track after finishing quarantine
180,Maxwell's Day out: RCB's
181,Maharashtra: Law colleges fear two first-year batches in 2021
181,"Swimming pools pile-up losses in Pune, professional swimmers hit"
182,'I was just hitting him for sixes': Hetmyer on facing India bowler in DC nets
182,Aakash Chopra names team which ‘can give competition to MI’ in IPL 2021
182,IPL 2021 | Reigning behemoth MI primed to crush all comers
182,IPL 2021: Delhi Capitals - Team profile and full squad
182,IPL 2021: Mumbai Indians - Team profile and full squad
182,Parthiv Patel wants MI to achieve 'biggest record' in IPL history
183,"Bumrah, Arjun, others sweat it out at the nets ahead of season opener - WATCH"
183,Dhoni steals the show in CSK’s intra-squad match ahead of IPL 2021 - WATCH
183,"Karthik names his ‘favourite partner’ in IPL, speaks about his batting position"
184,Lucknow University tightens COVID-19 restrictions
184,Nitish Kumar chairs high level meeting to review Covid-19 situation in Bihar
184,"Patna schools revert to online classes for new session, some are upset"
185,Abhishek Bachchan calls himself 'OTT ka Bachchan'
185,Abhishek Bachchan recalls Rishi Kapoor throwing a tantrum about Delhi-6's ending
185,"Amitabh to replace late Rishi Kapoor in The Intern remake, Deepika announces"
186,Here's how you can learn arts of the samurai on Zoom calls
186,Table Tennis | Sharath steps up Olympic preparation
187,Lone LJP MLA joins JD(U)
187,Lone Lok Janshakti Party MLA Raj Kumar Singh joins JD(U) in Bihar
188,BTSC Recruitment: Apply for 584 vacancies for fisheries officers and other posts
188,OPSC Recruitment: 92 vacancies notified for assistant soil conservation officers
189,"TN polls: Clad in PPE kit, Covid-19 positive Kanimozhi cast vote in Chennai"
189,Tripura CM Biplab Kumar Deb tests positive for Covid-19
190,3rd ODI: South Africa's Rassie van der Dussen ruled out of decider
190,Pakistan replaces injured Shadab with Zahid Mahmood for Zimbabwe T20Is
190,"Shadab Khan out of South Africa, Zimbabwe tours due to toe injury"
191,EU agency to share results of probe into AstraZeneca Covid-19 shot
191,Moderna Covid-19 vaccine rolled out in UK for the 1st time
192,Diary of a Wimpy Kid author Jeff Kinney's new book inspired by scary times
193,Night curfew back in Chandigarh
193,"Starting today, night curfew in Delhi from 10 pm to 5 am amid rising Covid cases"
193,"Starting today, night curfew in Delhi from 10pm to 5am amid rising Covid cases"
193,Will strictly enforce night curfew in Delhi: police
194,"Govt urges people to quit smoking, says increases vulnerability to Covid-19"
195,"Italy to allow fans at Euros, some other hosts yet to decide"
195,"Spain, Netherlands plan for fans at European Championship"
196,A timeline of Australia's Covid-19 vaccine plan mired in European back-and-forth
196,Australia short of 3 million AstraZeneca Covid-19 vaccine doses
197,K8 School is now powered by Discovery Education
198,Bihar tourism dept cancels all its April events amid rise in Covid cases
198,"Fearing second wave, Bihar tourism dept cancels all mega events"
199,Israel PM Netanyahu's trial resumes as parties weigh in on his fate
199,"Netanyahu's favours were 'currency', prosecutor says as corruption trial starts"
200,Jeegar Chauhan's inspiring journey from an outsider to mainstream producer
201,"Ashwin posts hilarious video with Rahane, Pant during DC photoshoot"
201,Specially-abled man’s video about acing life’s hurdles may leave you inspired
202,Parents’ protest over school fee spells trouble for Ludhiana commuters
202,Sambalpur univ students go on rampage demanding online semester exam
202,"Students and parents in Maharashtra ‘storm’ Twitter against offline SSC, HSC exams"
203,"Pulkit Samrat: If I am sitting at home in the lockdown despite giving a hit, what’s the point"
203,"Taapsee works hard for Shabaash Mithu, practises in open ground: 'No excuses'"
204,Bombay HC sets aside Bhalchandra Shirsat’s disqualification from BMC standing committee
204,HC seeks clarity on plan to demolish Lal Masjid
204,Tribunal reform ordinance upsets Congress
205,"Assembly Election 2021: Polling picks up as voting underway in 4 states, 1 UT"
205,Polling underway in Puducherry assembly elections
205,Tamil Nadu assembly election: Polling proceeds 'smoothly' with 40% voter turnout
206,"Akshay Kumar hospitalised after testing Covid-19 positive, shares health update"
206,"Bhumi tests Covid-19 positive, Kartik 'passes the baton' to her as he recovers"
206,Nushrratt goes into isolation after Akshay gets hospitalised for Covid-19
206,"Vicky Kaushal tests positive for Covid-19, in home quarantine"
207,"Covid-19 positive Farooq Abdullah getting better, tweets son Omar"
207,"Covid-19: Deve Gowda stable, eager for discharge, says hospital"
207,Shyam Thapa hospitalised after testing COVID-19 positive
208,Karan Johar remembers the time he 'flashed a smile with no mid life crisis pout'
208,Yash and Roohi literally fill Karan's shoes and prove posing is in their blood
209,"Pankaj Tripathi: My success and failure is not my personal anymore, it inspires others"
209,"Rana Daggubati on married life: Finally, I feel old and settled"
210,"Maharashtra notifies 269 sq. km. Kanhargaon Wildlife Sanctuary, state’s 50th"
210,Uttarakhand HC takes suo moto cognisance of alarming forest fires
211,"Allow citizens above 25 to get Covid jab, Maharashtra CM requests PM Modi"
211,"Allow citizens above 25 to get vax, CM requests PM"
211,Uddhav Thackeray urges PM Modi to lower the age bar for Covid vaccine to 25
212,Gold prices fall further today. Check rates in your city here
212,"Gold prices fall today, a day after increase. Check rates in your city here"
213,"Illicit liquor unit unearthed in Amritsar village, 3 held"
213,Pak-linked ISI terror module busted in Gujarat; three held
214,Truck landed on train track minute before deadly Taiwan crash
214,Workers clear last train from deadly crash site in Taiwan
215,Quad navies join France-led drills in Indian Ocean
215,Quad navies join France-led drills in Indian Ocean Region
216,"EVMs found at TMC leader’s house, 5 officials suspended"
216,"West Bengal: EVMs, VVPATs found from TMC leader's home, sector officer suspended"
216,"West Bengal: EVMs, VVPATs found in TMC leader’s house; sector officer suspended"
217,'Anil Deshmukh demanded
217,CBI team to reach Mumbai on Tuesday to probe Anil Deshmukh
217,"INX Media case: Delhi court exempts Chidambaram, son from personal appearance"
218,Covid-19: MP chief minister says not wearing masks amounts to 'crime'
218,Delhi CM Kejriwal asks PM Modi to remove age caps for Covid vaccinations
218,Jharkhand announces fresh curbs to tackle Covid-19
218,Karnataka health minister Sudhakar asks Centre for more doses of Covid vaccine
218,Open Covid-19 vaccination for all above 18: Medical association to PMO
219,"Karnataka bus strike from today, public transport likely to be affected"
219,News updates from HT: Karnataka bus strike from today
220,Retired teacher held for raping 19-year-old student in Hisar
220,Stepfather arrested in Kerala for murder of girl
220,Two girls raped in Amritsar
221,Centre asks its employees of 45 years and above to get vaccinated
221,Covid-19 vaccine eligibility expands to 16 and over in New York
222,'Passed 150 million': Joe Biden on Covid-19 vaccine doses administered in US
222,Biden to widen vaccination eligibility for all American adults
223,Don’t know if we’re ready for Asian Champions League: FC Goa coach Juan Ferrando
223,"Small-businesses, gym owners stare at losses during month-long restrictions"
224,'Don't think he needs much help': Ponting on new DC captain Pant
224,"'He’s an institution, there'll will be so much to learn from him'"
224,No place for DC's costliest buys of IPL 2021 in Chopra's ideal Delhi Capitals XI
224,Pant looking to ‘do something different’ in first game against Dhoni's CSK
224,Will Pant lead DC to their maiden IPL title? Kapil Dev gives fascinating answer
225,Anand Mahindra’s reply to small shop owner’s tweet is winning hearts
225,‘Are you an alien’: Elon Musk’s reply to Twitter user’s question sparks laughter
226,"Masks mandatory even while driving alone, rules Delhi high court"
227,Cash for judgement: ACB arrests Gaikwad’s associate in bribery case
227,ED arrests builder in NSEL case
228,Jammu and Kashmir: Rains in Valley following 3-day forecast for rains and snow
228,Thunderstorm in south Punjab leaves wheat growers worried
229,"Zeishan Quadri: The film industry was, is, and will remain biased"
230,"PM Modi urges people to vote in 'record numbers' in 4 states, 1 UT"
230,Panchayat polls: BJP releases second list
231,40-yr-old reservation demand conceded in TN: Is it working for PMK?
232,Fresh vaccine stock to arrive mid-April in Jharkhand
232,Nepal to administer Chinese vaccines to citizens from April 7
233,Colombia to extend Covid-19 restrictions as cases rise
233,Norwegian Cruises seeks permission from CDC to allow trips from US in July
234,Kolkata: Man held for making 'inappropriate comments' to judge over phone
234,One held for violent assault
235,"'Don't need Covid-19 vaccines, give us money': Afghan refugees to Pak govt"
235,"Experts see no link between Punjab Covid-19 surge, farm protest gatherings"
236,Arhtiyas won’t procure wheat if DBT payment mode not withdrawn
236,"Favour DBT, but Centre should defer it this wheat season: BKU (Ugrahan)"
237,Aviator EMF focuses on positive social impact in latest investments
237,India's air travel expected to double in next decade: Report
238,Inaaya plays with grandmom Sharmila as Soha looks on in new pic shared by Saba
238,Mira Kapoor throws back to stunning look in
239,TV fame Anupriya Parmar shooting her way through acting skill in Dhollywood
240,Covid-19: UK PM Johnson wants to make travel testing regime easy and cheap
241,"Life played a cruel joke, say kin of Ludhiana roof collapse victims"
242,Delhiwale: A roadside grave
243,Horoscope Today: Astrological prediction for April 6
243,Horoscope Today: Astrological prediction for April 7
244,DUTA organises outreach programme to create awareness about 12 DU colleges
244,"IIMC students demand to open campus, waive off fees"
245,Next round of military talks on LAC row likely on April 9
245,"Post Quad summit, India-China military talks on LAC friction possible on April 9"
246,Females in pain not taken as seriously as male patients: Study
247,1 more Maharashtra min will resign in 8 days: State BJP chief
247,Maharashtra BJP chief says one more MVA minister will resign in 8 days
248,Bombay HC says ByteDance should deposit $11 million in tax evasion case
248,Malaysia’s former PM Najib served with bankruptcy notice over tax bill
249,Aditi finishes T-67th at 2021 ANA Inspiration
249,Lahiri grabs first Top-5 since 2017 at Texas; Spieth wins after 3 years
250,Indian women lose 0-1 to Uzbekistan in football friendly
251,Amit Shah says BJP will win 63-68 seats in first three phases in Bengal
251,Kerala polls: LDF broadens its poll alliance to break trend and return to power
252,IPL 2021: Sunrisers Hyderabad - Team profile and full squad
252,Tennis | Yuki gears up for U.S. Challengers
253,"BJP to retain Assam, high voting signals pro-incumbency: Jitendra Singh"
253,"News updates from HT: 'Confident of winning by big margin', says E Sreedharan"
253,Shashi Tharoor says high voter turnout in Kerala polls indicates UDF victory
253,Tamil Nadu elections: Congress leader Karti Chidambaram cast vote in Sivaganga
253,‘Metro Man’ confident of winning by big margin as polling begins in Kerala
254,"European medicine agency says AZ Covid vaccine, rare blood clots in brain linked"
254,WHO does not back vaccination passports for now: Spokeswoman
255,"'Delhi Police will strictly enforce night curfew, issue fresh passes': PRO"
255,'I have just one request': Preity Zinta asks paps to follow Covid norms
255,16 prisoners flee from Jodhpur jail after throwing chilli powder on guards
255,Actors Vicky Kaushal and Bhumi Pednekar test positive for Covid-19
