255,"Anushka Sharma lifts Virat Kohli off floor in new video, watch duo's reaction"
255,Bengal polls: BJP worker's mother allegedly killed by TMC in Hooghly's Goghat
255,"Bihar Board class 10 results: Pooja Kumari, Shubhdarshini among toppers of BSEB"
255,Bombay HC orders CBI probe against Anil Deshmukh; Fadnavis questions CM Uddhav
255,"Chhattisgarh: 'Missing jawan could be in Naxals' captivity,' says Bastar IG"
255,Covid update: Delhi night curfew rules; Centre on vaccination eligibility
255,Covid update: Kareena's
255,Covid vaccine: Jail inmates get the jab at Gwalior central prison amid surge
255,Covid-19: Why is vaccination not open for all in India? Health Secretary answers
255,"Covid: 58% of active cases in India are from Maharashtra, says health secretary"
255,Delhi: 50-year-old man dies after beam of under-construction bridge collapses
255,"Dharmendra Pradhan, US special envoy John Kerry discuss energy & other issues"
255,"Gauri Khan switches on work mode, Preity Zinta at Hrithik Roshan's residence"
255,India's latest feat: Arch of world's highest rail bridge completed in J&K
255,Indore: Policemen allegedly thrash mask-less man; cop says viral video edited
255,Katrina Kaif under home quarantine after testing positive for Covid-19
255,"Kerala polls: Congress' fight for survival after 'G23' rebellion, Bihar debacle"
255,Kerala: Why opinion polls predicting LDF win may be wrong | Poll Baazi
255,"Leopard falls in 40-feet-deep well in Pune, finally pulled out by rescuers"
255,Maharashtra HM Anil Deshmukh resigns hours after HC ordered CBI probe
255,Night curfew imposed in Delhi till April 30 | All you need to know
255,"Nora Fatehi pulls a Kim Kardashian, wears basic top, cycling shorts and heels"
255,PHOTOS: JFK Library archives will help bring Ernest Hemingway to life
255,"Photos: After Maharashtra, Delhi imposes night curfew amid rising Covid-19 cases"
255,Photos: China registers highest daily Covid-19 case jump in over 2 months
255,Photos: India records highest single-day spike of Covid-19 cases ever
255,Photos: Training opens 'a window of hope' for traditional Albanian rug-weavers
255,"Pooja Hegde's chic baggy jumpsuit is the twist you did not know you needed, pics"
255,"Prakash Javadekar, Biden’s special envoy John Kerry discuss ‘climate finance’"
255,"RBI Monetary Policy: Repo rate, reverse repo rate remain unchanged"
255,RBI retains GDP growth projection at 10.5% for FY 2021-22
255,Rafale | 'How much bribery...' asks Congress after French report; BJP responds
255,Rahul Gandhi calls Chhattisgarh anti-Naxal op ‘poorly designed’; BJP slams CM
255,Russia to make military tech in India? Sergey Lavrov answers during Delhi trip
255,"Tamil Nadu Assembly polls: Rajinikanth, Kamal Haasan cast their votes in Chennai"
255,"Tamil Nadu polls: Actor Vijay cycles his way to polling booth, video goes viral"
255,Taslima Nasreen’s tweet on Moeen Ali sparks row; England cricketers lash out
255,UP CM Yogi announces ex-gratia for kin of jawan killed in Chhattisgarh encounter
255,Watch: Amit Shah eats at rickshaw puller's house; TMC defector's 'bhatija' jibe
255,"Watch: Amit Shah, Bhupesh Baghel pay respect to martyrs in Chhattisgarh"
255,Watch: CCTV shows Sachin Vaze going to train station day before Mansukh's death
255,"Watch: DMK’s Kanimozhi, Covid-19 positive, votes wearing PPE kit in Chennai"
255,Watch: IAF chopper lifts water in bucket to douse forest fire in Uttarakhand
255,Watch: India sends back Pakistani resident via Teethwal crossing in J&K
255,"Watch: Leopard strays into Jammu locality, injures three before being captured"
255,"Watch: Major fire breaks out at market in Mumbai's Kurla, no death reported"
255,"Watch: Presence of terrorists suspected, Srinagar's Gulab Bagh cordoned off"
255,"Watch: Relatives of woman, who died of Covid, vandalise hospital; 10 arrested"
255,"Watch: Threat email against Amit Shah, Yogi Adityanath received by CRPF"
255,Watch: UP CM Yogi gets first dose of Covid vaccine; urges people to follow norms
255,"Watch: Vandalism, arson by mob in Bihar's Sasaram as cops enforce Covid rules"
255,West Bengal polls: EVMs & VVPATs found at TMC leader’s residence in Uluberia
255,West Bengal: Media persons allege ‘pushing’ by security at polling booth
255,What Delhiites think about wearing face mask even while driving alone | Covid
255,"Will BJP be vote-cutter, king-maker, or stage major upset? Decoding Kerala polls"
255,‘All adults in US eligible for Covid vaccination from April 19’: Joe Biden
255,‘BJP knows TMC is losing election because…’: PM Modi mocks Mamata Banerjee
255,‘BJP means freedom from dynastic politics’: PM Modi on party’s foundation day
255,‘Covid second wave mostly infecting young adults and children’: LNJP MD
255,‘Even Donald Trump didn’t go this far’: Mamata Banerjee attacks PM Modi
255,"‘False narratives against CAA, farm laws a well planned conspiracy’: PM Modi"
255,"‘Govt will welcome surrendered Naxals, but no option if…’: Amit Shah"
255,‘IPL 2021 to go ahead with restrictions in Mumbai’: Nawab Malik confirms
255,‘If Abhinandan was brought back from Pak…’: Missing CRPF jawan’s kin to govt
255,"‘India getting job done on climate, pushing the curve’: John Kerry"
255,‘India-Russia dialogue at sustainable highest': Lavrov meets EAM Jaishankar
255,"‘Missing jawan in our captivity,’ claim Maoists; set conditions for his release"
255,"‘Mumbai facing Covid vaccine shortage, stock may exhaust in 2-3 days’: Mayor"
255,‘No shortage of Covid Vaccine in any part of the country’: Harsh Vardhan
255,‘PM Modi will also sell the country soon’: Mamata Banerjee attacks Centre
255,‘Spoke to Akshay Kumar after he tested Covid positive’: Riteish Deshmukh
255,‘Uddhav has forfeited moral authority to govern’: BJP after Deshmukh resigns
255,‘Will turn into a tsunami…’: Congress warns Modi govt over Covid second wave
255,‘Will win Bengal on one leg & Delhi on two’: Mamata Banerjee’s dare to BJP
255,‘Will win battle against Naxals’: Amit Shah & Baghel hold top level meeting
256,"After French report on Rafale payment, Congress demands independent inquiry"
256,Dassault paid 1 million euros to ‘middleman’ in Rafale deal: French media
256,"Rafale deal: Cong, BJP trade barbs as report says €1 mn paid to ‘middleman’"
257,Most travellers postponing trips due to rise in Covid-19 cases: Portals
258,Maoist attack: How Sikh jawan took off turban to help wounded colleague
258,Maoist attack: Sikh jawan uses turban to help injured colleague
259,"Waste to art: Imitations of Sarnath Stupa, Taj Mahal and Ganga ghat installed at Mahamaya Flyover in Noida"
260,"Attack on Unnao Judge: Bar Council submits probe report, seeks explanation from lawyers involved"
260,SC raps CBI over delay in filing appeal in graft case
261,Kangana reacts as fan recreates her ‘flag-bearer of nepotism’ moment from KWK
261,"Kareena Kapoor makes simple request to fans amid rising Covid-19 cases, see pic"
261,"Snehil Dixit Mehra spots Cristiano Ronaldo, posts clip with DDLJ's ‘palat’ twist"
262,"Hina Khan is an ethereal bride in lehenga named after her, it costs"
262,When Sushmita recalled incident where 15-year-old misbehaved with her in public
263,Covid-19: Gujarat government orders 3 lakh Remdesivir injections
263,News updates from HT at 1 pm: Zydus Cadila seeks DCGI nod for Covid-19 drug
263,Zydus Cadila seeks DCGI nod for use of hepatitis drug for Covid-19 treatment
263,Zydus Cadila seeks regulatory approval for Covid-19 drug
264,Covid-19 positivity rate in Delhi above 5%: Why it's a matter of concern?
264,"Night curfew imposed in Delhi from today. Here's what's allowed, what's not"
264,Night curfew in Delhi to control Covid-19 spread. See pictures
265,The gulf between Delhi and Moscow
265,US asks Russia to explain 'provocations' on Ukraine border: State Department
266,"11,000 fresh Covid cases in Pune district as vaccination numbers fall"
266,Former India wicketkeeper and MI scout Kiran More tests positive for Covid-19
266,"Mohali clocks 501 Covid cases, tricity breaches 900 mark"
266,"Over 10,000 new Covid cases in Mumbai again; Maharashtra tally up by nearly 60K"
266,"Pune district reports 8,211 new Covid cases, six deaths"
266,State logs over 1k cases for first time this year; Ranchi positivity rate at 18%
266,What is driving India’s second Covid-19 wave?
267,Anomalies in UPSSSC recruitment: SIT arrests 11
267,Five more arrested for Mar 27 attack on BJP MLA
267,"Madhubani killings: Kingpin arrested, top cop rules out caste angle"
267,"Madhubani massacre case main accused arrested, links with BJP MLA alleged"
268,"Kerala polls: police personnel, central forces, drones deployed for security"
268,"Polling for 404 seats in south ends, high voter turnout"
268,"Polling in Tamil Nadu proceeds smoothly, sporadic violence in Kerala"
268,Tripura district council polls begin amid tight security
269,"Sensex climbs 300 points after RBI policy outcome; Nifty jumps over 14,750 level"
269,"Sensex closes 460 points higher at 49,661, Nifty above 14,800"
269,"Sensex rebounds over 300 points after opening in red, Nifty up by over 99 points"
270,Kim Kardashian joins the billionaire club
270,"Mukesh Ambani India's richest in Forbes list, Gautam Adani 2nd"
271,"Study of Astra vaccinations in children is paused, Oxford says"
271,Study of AstraZeneca vaccinations in children is paused: Oxford University
272,Explained: Minneapolis chief seeks to reform police department
272,Minneapolis police chief testifies Chauvin violated policy in Floyd arrest
273,Minister rules out lock-down or night curfew
273,"Situation in neighbouring Maharashtra, Karnataka being monitored: Goa CM"
274,"At stake, the future of the Indian polity | HT Editorial"
274,"Polling to take place in Kerala on Tuesday; UDF, LDF, NDA in triangular contest"
275,Assam: Magnitude 2.7 earthquake strikes Tinsukia
275,"Tremors rattle Himachal’s Chamba, Lahaul and Spiti districts"
276,AIADMK moves EC to revoke polls in 5 key seats
276,Congress demands re-polling in Taliparamba
277,"Amid rising Covid cases, IMF raises India outlook"
277,Jharkhand to get 12 lakh vaccine doses in 2 days
278,Bengal polls: 205 candidates will fight it out at 31 seats in third phase
278,Stage set for third phase of polls in 31 South Bengal seats
279,Biden's economic plan gets boost from Senate procedural ruling
279,White House aims to create legal ways for Central Americans to migrate: US envoy
280,"'Govt exported 64.5m Covid-19 vaccines, haven't inoculated these many here': AAP"
280,AAP hits out at BJP for Covid-19 vaccine exports
281,Galat video: Rubina Dilaik gets fooled in love. Watch here
281,"Hollywood's Andy Long joins Liger team for stunt choreography, Ananya rejoices"
282,"Sam L Wright is a young entrepreneur, skyrocketing brands and their credibility"
283,"Karnataka govt rules out negotiations with RTC workers, warns against strike"
283,"RTC strike: Decision on invoking ESMA depending on situation, says Karnataka CM"
284,"Div commissioner asks state govt for additional 165 regular ventilators, 22 paediatric ventilators"
284,PMC to procure Remdesivir injections
285,"Covid-19 surge: Harsh Vardhan to meet health ministers of 11 states, UTs"
285,Health minister says Covid-19 surge can be contained if people follow rules
285,News updates from HT: Health minister says follow Covid rules to contain surge
286,Delhi Metro to only allow essential workers in trains after 10pm due to curfew
287,'He was street-smart in making bully of Fakhar Zaman': Kaneria on the run-out
287,'So it's not funny that batsman stopped running instead of completing the run?'
288,"MCG to introduce 2,000 e-rickshaws, will hold meeting with owners of diesel autos"
288,"RTA announces subsidies, scrap costs to replace old diesel autos with e-rickshaws"
289,"Cable work, manual traffic management results in 4-km traffic snarl on Dwarka Link Road"
289,Commuters troubled as part of CISF Road overflooded due to water pipeline damage
290,"Fadnavis writes to Maharashtra CM, calls for relaxation of curbs"
290,Maharashtra traders give ultimatum to CM Uddhav Thackeray to withdraw shutdown
291,"Actor Vijay cycles his way to the polling booth, watch"
292,"30-kg heroin seized along border in Tarn Taran, Pak smuggler held"
292,"Pak smuggler shot dead, 22-kg heroin, 2 AK-47 rifles seized at Amritsar border"
293,"News updates from HT: Video claims 50,000 Covid-19 deaths in India, WHO denies"
293,"Video claims 50,000 Covid-19 deaths in India by April 15, WHO says it's fake"
294,'Will fix rates for Covid-19 treatment in hospitals': CM Shivraj Singh Chouhan
294,"Amid rise in Covid-19 cases, Delhi govt orders increase in hospital beds"
294,"Govt orders additional 4,857 beds in hospitals as cases surge"
295,Madhubani killings: Caste militias in spotlight again
295,"Madhubani killings: RJD, Cong raise the heat"
295,Nitish Kumar vows to spare no one in Madhubani killings as criticism mounts
296,Lend the warmth of your heart to keep strays cool this summer
297,Best buy under
297,Samsung F12 launched with True 48MP Quad Cam and 90Hz Display under
298,Assam records 84.96% turnout in Phase 3 of polls
298,"With high turnouts, polls close in Assam, Kerala, Tamil Nadu and Puducherry"
299,Election promises bring no relief for stressed Tiruppur textile units
299,Elections promise no relief for Tiruppur’s stressed textile industry
300,Bhandup mall administrator gets relief
300,"Mumbai sees deserted streets, chaos on Day 1 of partial lockdown"
301,Could Chhattisgarh’s U-type Maoist ambush have been averted?
301,Decisive turn in fight against Maoists: Amit Shah
301,Fight against Maoists will continue at quicker pace: Chhattisgarh CM
301,"Govt will end Maoist menace, says Amit Shah on Chhattisgarh visit"
301,"Maoists issue statement, say their fight not against security forces"
301,"We will win in the end, says Amit Shah after Chhattisgarh anti-Maoist Op meet"
302,Kareena Kapoor is ready for a workout session but reveals she wants a tan
302,"Shraddha Kapoor looks fresh as a flower in beaded crop top, blush pink cape set"
302,Shraddha Kapoor treats fans to sunkissed pictures from Maldives
303,"As Bengal gears up for phase 3 polls, Covid-19 cases shoot up"
303,"Cases spike in Bengal amid election season, officials say norms flouted"
304,"Admission process for EWS, disabled students in entry-level classes begins today"
304,"Students appear for SPPU mock test exams, some face technical issues"
305,Active caseload rising; 550 new cases in Kozhikode
305,"UK, California, Manaus: What they suggest about the Covid crisis in Maharashtra"
306,"Barcelona nets late winner, cuts Atletico's lead to 1 point"
306,Liverpool will have a chance when Real come to a 'proper stadium'
306,Real Madrid beat Liverpool 3-1 in 1st leg of CL quarterfinals
306,Renewed Real complete transformation by blowing Liverpool away
307,Accelerate inoculation drive in India first before sending vaccines outside: AAP
307,"State, Centre disagree over oxygen supply guidelines"
308,Former school teacher battles to save Indonesia's mangroves
309,"Covid-19: Over 6,000 new cases reported in Karnataka, active cases also spike"
309,"India surpasses US to become fastest Covid-19 vaccinating country, says Centre"
309,Intensive testing in containment zones as Covid cases spike in Bihar
310,Didi banks on Trinamool women brigade to stop BJP onslaught
311,"E-commerce giant to set up fulfilment centre in Haryana’s Manesar, to be one of its largest centres in Asia"
311,Flyover to decongest Narela-Bawana opens
312,PM to inaugurate vessel for Seychelles
312,Putin signs law allowing him 2 more terms as Russia's leader
313,Ed attaches
314,J&K High Court switches over to virtual hearing
315,Factory activity falls to 7-month low in March
315,Karol Bagh traders oppose pedestrianisation move
316,Russia extends punitive Twitter slowdown until mid-May
316,UK to announce new international travel rules
316,"US, Iran begin indirect talks in Vienna to revive 2015 nuclear deal"
317,Greater Noida engineer robbed: Lawyer among four arrested
317,"Woman abducted, gang-raped on pretext of lift by cab driver"
318,Emergency vehicles to be allowed in revamped Chandni Chowk stretch: Jain
318,Flyover at Bakhtawar Chowk to smoothen traffic flow
319,"Iran: Man kills 9-year-old son, 7 other relatives before dying by suicide"
319,"One killed, 2 hurt in three firing incidents in outer Delhi"
320,Padma Shri educationist Gowri Ishwaran joins leadership board of VEGA Schools
321,"Chopra picks ideal RCB XI for IPL 2021, leaves out 2 prominent Australians"
321,"IPL 2021: Full schedule, venues, dates, timings- All you need to know"
321,"Kohli, ABD and Maxwell team up for fun photo shoot in RCB's new kit"
321,They will win it: Michael Vaughan gives early prediction on IPL 2021 winners
322,'Don't see him in CSK first-XI': Ojha on star India batsman
322,'He is not your gun death bowler': Chopra explains how KKR should use Cummins
323,"Fishnet stockings, booties: Jill Biden's airport look leaves Twitter divided"
324,"In new India, leveraging the country’s great mineral potential"
325,Delicious Grilled Thai Chicken Salad to kick away your Monday blues: Recipe
325,Recipe: Let Thai red curry with chicken thighs treat you after a long work day
326,Betting can lead to match-fixing: New BCCI ACU boss
327,Himachal imposes fresh curbs on gatherings
327,Maha govt paves way for IPL; allows teams to practice post 8 pm at Wankhede
327,Traders say Delhi govt should have consulted before announcing night curfew
328,Maguire would be bigger loss for England as compared to Kane: Neville
329,Florida evacuations order lifted as danger from leaky wastewater reservoir fades
330,Delhi woman held with heroin in Mohali’s Lalru
330,Police bust child trafficking racket while searching for stolen baby
331,C’garh Maoist attack a retaliation to increased presence of forces: Officials
331,Venezuela to ask UN for help in clearing land mines near Colombian border
332,"Assembly polls over, Kerala tightens Covid-19 restrictions"
332,State to intensify COVID-19 containment
333,Osaka requests cancellation of torch relay leg
333,Tokyo Olympic torch relay taken off streets of Osaka
334,Over 84 million Covid vaccine doses administered across India
334,"Over a million doses administered in Pune, 8% of population get first dose"
335,5 IIT Roorkee hostels sealed after 60 students test Covid positive
335,"St Stephen’s to reopen today, two blocks to stay shut"
336,Bombay HC directs CBI to conduct preliminary probe against Anil Deshmukh
336,Bombay HC orders preliminary CBI probe into charges against Anil Deshmukh
337,Why do we pick problematic partners?
338,Right time to get a women's league to build strong women's team: Mandhana
339,Abducted Bihar man freed by ULFA on Myanmar border
339,Bihar man abducted by ULFA-I from Arunachal released after 105 days
340,Recipe: Spruce up your week day meal with these easy to make Mexican enchiladas
341,Jio inks pact with Airtel for acquisition of some spectrum
342,"Anushka Sharma lifts husband Virat Kohli off the floor, asks 'Did I do it?'"
342,"Ramya Krishnan moved to tears by Rekha’s performance on Indian Idol 12, watch"
343,"IL&FS sells environment business to EverSource, reduces debt by"
344,Delhi court grants bail to businessman in VVIP chopper case
344,Delhi court grants bail to former TMC MP K D Singh in money laundering case
345,'Pariksha Pe Charcha' to be held virtually on April 7
345,Join fourth edition of 'Pariksha Par Charcha' with PM Modi tomorrow
345,PM Modi's 'Pariksha Pe Charcha' to be held today
345,"Pariksha Pe Charcha 2021 highlights: Study hard and play hard, PM to students"
346,"Phase 3: TMC, BJP continue to accuse each other of polling malpractices"
346,‘Misuse of forces’: Mamata rages again as Phase 3 polling underway in Bengal
347,Allahabad HC suspends mediation cases till further order
348,BJP is not an election-winning machine: PM Modi on party’s foundation day
349,SC stays trial against Yediyurappa in ‘illegal’ land denotification case
350,"Small cruises are thriving, not just surviving, on the Mississippi"
351,"Govt amends IBC, rolls out pre-pack plans for MSMEs"
352,Bizmen brothers robbed of
352,Man wanted in 39 criminal cases arrested after brief encounter with police
352,"Seven robbers, snatchers nabbed in Noida"
352,Two held with 4.7kg stolen gold jewellery in Mohali
353,"5.4 earthquake in Sikkim-Nepal border, tremors felt in Assam, Bengal"
353,"Sikkim earthquake sends tremors past Bengal, Bihar, Assam; no risk of aftershock"
354,Taarak Mehta director responds to disgruntled fan who called the show 'terrible'
355,‘Maharashtrians face the brunt’: Raj Thackeray blames migrants for Covid-19 surge
356,Ever wondered how Kylie Jenner maintains those abs? Her new video will tell you
357,"Dharmendra, Shatrughan Sinha reward Dance Deewane contestant with"
357,Happy Birthday Jeetendra: A tribute to the ‘Jumping Jack’ of Bollywood
358,"Jab for those who ‘need’ it, not those who ‘want’ it: Centre"
358,Rahul Gandhi bats for Covid vaccine for all; slams Centre’s ‘need vs want’ logic
358,"Yogi gets first dose of Covid vaccine, appeals to follow protocol"
359,Tiger Shroff flaunts washboard abs in new beach photo. Here's how he keeps fit
360,Army chief visits Defence Services Staff College in Tamil Nadu's Wellington
361,Ansari’s wife approaches SC
361,Mukhtar Ansari's wife approaches Supreme Court
362,'Centre replenishes more Covid-19 vaccine than needed': Javadekar
363,Uttarakhand forest minister posts a video fighting forest fire; slammed
364,IPL 2021: Big buys and a bang for the buck
364,IPL 2021: Will RCB's gamble on Maxwell and Jamieson work?
365,US airlines bringing back more pilots as travel demand rebounds
365,United Airlines seeks to build its own diverse pipeline of pilots
366,"Telangana, Andhra see spike in Covid-19 infections; positive cases cross 1,000"
366,"UP’s Monday figures: 3999 fresh cases, 13 deaths"
367,"Day after roof collapse, Ludhiana MC recommends FIR against lintel lifting"
368,Video featuring specially-abled woman’s work out session may inspire you
369,JEE Main April 2021 correction window last date extended
369,"NEET PG 2021: Application correction deadline extended, check details"
370,Can’t remain a mute spectator: Bombay HC on PILs against Anil Deshmukh
371,Air India Boeing pilots seek urgent meeting with aviation minister over pay cut
372,"Hansal shares pic of son with Down Syndrome after govt's 'need, not want' remark"
372,"Kapil and Sunil exchange pleasantries on Twitter, fans want reconciliation"
373,Australia-NZ 'travel bubble' to begin April 19 in pandemic milestone
373,Coronavirus: Tasman travel bubble; toddlers as silent spreaders
373,PM Ardern sets April 19 for start of Australia-New Zealand travel bubble
374,Rahul Dravid invited to speak at MIT sports analytics conference
374,Robin Uthappa presented IIM-K National Excellence Award
375,"Lavrov, Kerry ‘run into each other’ at hotel, have brief chat"
375,"Sergey Lavrov, John Kerry meet in India, discuss climate-related matters"
376,Byju's acquires Aakash Educational Services for about $1 billion
377,Alia Bhatt finds strength in motivational quote as she recovers from Covid-19
377,"Kangana Ranaut spotted at a dubbing studio without a mask, Suyyash Rai reacts"
378,'He reminds me a bit of Pollard': Kumble lauds 25-year-old Punjab Kings' batsman
378,'He said I will get better with experience': Natarajan recalls Dhoni's advice
379,'Hardik and I are just reaping the fruits of his efforts'
379,2 ground-staff members among 3 more positive Covid-19 cases at Wankhede
379,IPL 2021: Sunrisers Hyderabad all-rounder Jason Holder arrives in Chennai
380,Struggling Alaves part ways with head coach Abelardo
381,"Manipur probe almost over, allow SIT officers to do other work: CBI to SC"
382,Atelier Clout is fashion designer's trusted stop for growth & digital solutions
383,India’s ‘double mutant’ Covid strain found in US
383,India’s ‘double mutant’ Covid-19 variant detected in US
384,India beat Argentina 4-3 for winning start to tour
384,India face Olympic hockey champions Argentina in FIH Pro League restart
384,We're looking at Argentina tour to build momentum ahead of Olympics: Harmanpreet
385,"3,050 containment zones in Lucknow, Indira Nagar tops list with 400"
386,"Sanju Samson interview: 'Got texts from Kohli, Dhoni after becoming RR captain'"
387,79.16% voter turnout in Salem district
387,80.04% polled in Namakkal district
387,Puducherry records 81.70% turnout in assembly polls
388,"Oil prices rise on stronger economic outlook, US stockpile draw"
389,Shilpa Shetty's variation makes Yoga’s tricky Eka Pada Rajakapotasana look easy
390,Joji movie review: Top-rate crime thriller headlined by a terrific Fahadh Faasil
391,Noida: Spike makes April worst Covid month this year
392,Training opens 'a window of hope' for Albanian rug-weavers
393,World Health Day: Kajol states the 5 rules of staying healthy with a throwback
394,Friends App's community-driven approach brings in a better social experience
395,AstraZeneca Covid-19 vaccine risk-benefit 'still largely positive': WHO
396,US President Biden likely to name Evercore’s Bianchi as trade deputy
397,Sputnik maker ties up with Indian firm to produce 100 mn doses
398,"As cases surge, officials told to keep close watch on 4 Valley dists"
399,'All Mumbai beaches shut till April 30': BMC announces fresh Covid-19 curbs
399,All Mumbai beaches to stay shut till April 30: BMC
