0,Best buy under
90,"Karthik names his ‘favourite partner’ in IPL, speaks about his batting position"
90,Rajasthan Royals organise stadium live show to launch 2021 IPL jersey
91,No relief announced for Ludhiana factory next to roof collapse site
91,Roof collapse: Ludhiana’s industrial units run foul of most local building by-laws
92,"Amid rise in Covid-19 cases, Delhi govt orders increase in hospital beds"
92,"Div commissioner asks state govt for additional 165 regular ventilators, 22 paediatric ventilators"
92,"Fed up with smart meters, Over 6,000 power consumers say no to power’"
92,Fresh curbs on gatherings announced in Panchkula
92,"Govt orders additional 4,857 beds in hospitals as cases surge"
92,PMC to procure Remdesivir injections
92,US disbursed over 150 million stimulus payments in Biden relief plan
93,Covid-19 positivity rate in Delhi above 5%: Why it's a matter of concern?
93,Delhi Metro to only allow essential workers in trains after 10pm due to curfew
93,"Night curfew imposed in Delhi from today. Here's what's allowed, what's not"
93,Night curfew in Delhi to control Covid-19 spread. See pictures
94,"2 days before IPL 2021 opener, RCB's Daniel Sams tests positive for Covid-19"
94,Coronavirus | RCB’s Daniel Sams tests positive
94,"MI players, support staff return Covid negative after More's positive test"
94,Private school shut after 7 students test Covid-positive
95,"Twinkle Khanna enjoys poetic morning, shares glimpse into her garden"
96,Aditi finishes T-67th at 2021 ANA Inspiration
96,Lahiri grabs first Top-5 since 2017 at Texas; Spieth wins after 3 years
97,"Ramayana Museum and Cultural Centre to be established between Ayodhya, Lucknow"
98,Clip of this woman describing her good boy doggo may wipe your mid-week blues
99,"As Maoist violence returns, decoding the rise of ultra left insurgency"
99,Maoism remains India’s biggest internal security threat
99,"Maoists cross a red line, again | HT Editorial"
99,Who is Madvi Hidma? Mastermind of U-type Maoist ambush in Chhattisgarh
100,India equipped to tackle risk posed by fresh Covid-19 wave: Sitharaman
100,India well-prepared to combat second wave of Covid-19: Finance ministry report
101,Kareena Kapoor is ready for a workout session but reveals she wants a tan
101,"Shraddha Kapoor looks fresh as a flower in beaded crop top, blush pink cape set"
101,Shraddha Kapoor treats fans to sunkissed pictures from Maldives
101,"Vidya Balan slays perfect summer getaway look in a satin blouse, printed skirt"
102,Karnataka imposes restrictions under Sec 144 in Bengaluru city limits
102,News updates from HT: Karnataka bus strike from today
102,News updates from HT: Section 144 in Bengaluru city limits as virus cases rise
103,"45% turnout in four MCs, 59% vote in six nagar panchayats of Himachal"
103,"Assembly Election 2021: Polling picks up as voting underway in 4 states, 1 UT"
104,Anti-extortion cell arrests two for
104,Bihar court jails women drug smugglers jailed for 15 years
104,Four vehicle thieves nabbed in Noida
104,Mumbai crime branch arrests four with
105,Top 10 trusted blockchain development companies In India 2021-2022
106,"'The emphasis is on AB, Kohli': Vettori suggests 'best way to utilise' Maxwell"
106,BBL-winning captain ready to share winning mantra with KL Rahul in IPL 2021
106,IPL 2021: Maxwell explains why
106,Ricky Ponting reveals Steve Smith’s batting position in IPL 2021
107,"Kapil's fan wants to work with him, he says 'Mai to khud ghar pe baitha hun'"
107,Taarak Mehta Ka Ooltah Chashmah director reacts to fan’s request for new Dayaben
108,Arch of world’s highest railway bridge on Chenab completed
108,Unparalleled feat: Indian Railways completes arch of world’s highest rail bridge
109,Stigma blamed as COVID-19 patients keep off voting
110,"TJEE 2021 registration begins on tbjee.nic.in, here’s how to apply"
110,UPSC IES ISS Recruitment 2021: Registration begins at upsc.gov.in
111,Ambulances to be used centrally for ferrying Covid patients
111,Centre allows registrations for health workers only at govt vaccination sites
111,Delhi CM Kejriwal asks PM Modi to remove age caps for Covid vaccinations
111,Open Covid-19 vaccination for all above 18: Medical association to PMO
111,"Soon, vaccination for Gurguram industrial employees at govt sites"
112,Anomalies in UPSSSC recruitment: SIT arrests 11
112,Five more arrested for Mar 27 attack on BJP MLA
112,Kolkata: Man held for making 'inappropriate comments' to judge over phone
112,"Madhubani killings: Kingpin arrested, top cop rules out caste angle"
112,"Madhubani killings: RJD, Cong raise the heat"
112,"Madhubani massacre case main accused arrested, links with BJP MLA alleged"
113,Fresh cases in Hassan
113,"Haryana records 2,099 new Covid cases, 9 deaths"
113,"Highlights: More than 76,000 beneficiaries vaccinated against Covid in Delhi"
113,LIVE: Over 88 million Covid-19 vaccine doses administered in India so far
113,"News updates from HT: At 3,548 Covid-19 cases Delhi's daily tally dips slightly"
113,Over 79 million Covid-19 vaccine doses administered in India: Health ministry
113,"Punjab logs 62 deaths, 2,924 Covid new cases"
113,"UP’s Covid numbers on the rise: 5,928 fresh cases, 30 deaths"
113,"VC, 40 KGMU doctors among 1,188 people test positive in Lucknow"
114,"In SAD’s Ludhiana publicity blitz, Sr Badal is conspicuously missing"
114,"Sonia appeals to kerala voters to bring UDF govt, ‘strengthen the Cong nationally’"
115,"Russian Olympic champions Silnov, Antyukh banned for doping"
115,Soccer-AFC bans Brazilian striker Jaja for four years over doping violation
116,Widespread rain and thunderstorm likely over western Himalayan region today
117,Shilpa Shetty corrects fitness freaks' Cycling Yoga flow or Pada Sanchalanasana
118,T. Rex or humans- Who will win in a race? Question sparks debate among tweeple
119,U.S. military cites rising risk of Beijing’s move against Taiwan
119,US military cites rising risk of Chinese move against Taiwan
120,Olympic-bound tennis ace Sania included in TOPS after gap of four years
121,"Dharmendra, Shatrughan Sinha reward Dance Deewane contestant with"
121,Happy Birthday Jeetendra: A tribute to the ‘Jumping Jack’ of Bollywood
122,"N. Korea to not attend Tokyo Olympics, dashes Seoul's hopes of restarting talks"
122,Olympics: Tokyo organisers to cancel water polo test event - NHK
123,"Maroon 5’s Adam Levine dons a dress, shares cute pic with family"
123,"Saba shares fresh pics of Taimur and Soha, shares what photo studio guy told her"
123,"Sushmita Sen shows 'reel and real' avatar, Rohman Shawl and Renee are all love"
124,Financial regulator asks G20 countries to prepare Covid-19 relief exit plan
125,'He reminds me a bit of Pollard': Kumble lauds 25-year-old Punjab Kings' batsman
125,'He said I will get better with experience': Natarajan recalls Dhoni's advice
125,Tom Moody explains why SRH bought ‘very effective' bowler at IPL 2021 auction
126,Palacodde constituency registers highest poll percentage in the State
126,Palayamkottai brings down Tirunelveli district’s poll percentage
126,Voter turnout drops by 2.48% in Erode district
127,Anil Deshmukh moves Supreme Court against Bombay HC order directing CBI probe
127,CBI team to reach Mumbai on Tuesday to probe Anil Deshmukh
127,"EC notice to DMK's Udhayanidhi for remarks on Arun Jaitley, Sushma Swaraj"
127,"Maha CM accepts Deshmukh's resignation, Dilip Walse Patil takes charge"
127,Our aim is to create transparent police force: New Maharashtra home min
127,Patil starts stint as Maharashtra home minister with a promise and appeal in SC
128,India records third warmest March in 121 yrs: IMD
128,India saw third warmest March in 121 years: IMD
129,Got lockdown blues? Take your taste buds on a trip with this Goan Fish Curry
130,Leopard rescued from 40-ft-deep well in Pune district
131,"As Bengal gears up for phase 3 polls, Covid-19 cases shoot up"
131,"Cases spike in Bengal amid election season, officials say norms flouted"
132,Astronomers trace rare blast to Wolf-Rayet stars
133,IBPS clerk Office Assistant IX provisional allotment list 2021 released
133,Municipal Corporation of Chandigarh Recruitment: Apply for 172 posts from Apr 8
133,"RSMSSB JE answer key 2021 released, check it here"
133,"SSC JE answer keys 2021 released, direct link to check them and raise objections"
133,"UPSC Civil Services main interview schedule released, check here"
134,PMC seeks 450 beds of Southern Command hospital for Covid treatment
134,Pune collector seeks military assistance for additional Covid patient beds
135,"Anushka Sharma lifts husband Virat Kohli off the floor, asks 'Did I do it?'"
135,Deepika Padukone or Alia Bhatt? Who wore the
135,"Kangana claims Akshay, others messaged her secretly praising Thalaivi trailer"
135,Madhuri Dixit shows off another stunning date night look
135,"Raveena shares throwback monochrome pic from '90s, fans rave about her beauty"
135,Sona Mohapatra says Rekha gave boost to 'sad' Indian Idol
135,"Taapsee works hard for Shabaash Mithu, practises in open ground: 'No excuses'"
135,When Ranbir snapped at Anushka for slapping him: 'I told you not to do it'
136,"A third of Covid-19 survivors suffer neurological, mental disorders: Study"
136,"Covid boosts risks for mental, neurological disorders in study"
137,"Study of Astra vaccinations in children is paused, Oxford says"
137,Study of AstraZeneca vaccinations in children is paused: Oxford University
138,"IL&FS sells environment business to EverSource, reduces debt by"
139,"Day after Ludhiana factory roof collapse, factory owner arrested"
139,Maoists release photograph of missing CoBRA commando
140,"Attack on Unnao Judge: Bar Council submits probe report, seeks explanation from lawyers involved"
141,Tennis | Sania back on track for Tokyo Olympics
141,When will next generation of tennis overtake the Big Three?
142,Delhi woman held with heroin in Mohali’s Lalru
142,Man booked for uploading woman’s pictures without consent
142,Mother kills 3-year-old daughter
142,Police bust child trafficking racket while searching for stolen baby
142,"Rickshaw driver, accomplice arrested for molesting woman in Mumbai a month ago"
142,"Woman abducted, gang-raped on pretext of lift by cab driver"
143,"Allegations against Anil Deshmukh: CBI team reaches Mumbai, begins probe"
143,Bombay HC orders preliminary CBI probe into charges against Anil Deshmukh
143,CBI may record Param Bir Singh’s statement in Bombay HC-directed inquiry today
143,"Lalchand Rajput urges MCA Ombudsman to ""reinstate CIC"" led by him"
143,Lawyer who filed PIL in Bombay HC against Anil Deshmukh
144,Summer vibe done right!
145,'Hardik and I are just reaping the fruits of his efforts'
145,2 ground-staff members among 3 more positive Covid-19 cases at Wankhede
146,Shashi Tharoor says high voter turnout in Kerala polls indicates UDF victory
147,"Polling in 4 states, Puducherry on Tuesday; heavy security arrangements in place"
148,"Fire at hardware shop in Gurugram, no casualty reported"
148,"Major fire breaks out Mumbai's Kurla, no injuries reported"
148,Major fire destroys natural gas pipeline in Ambegaon Khurd
149,'All Mumbai beaches shut till April 30': BMC announces fresh Covid-19 curbs
149,All Mumbai beaches to stay shut till April 30: BMC
149,Maharashtra: All shops to remain shut in Pune till April 30
150,Govt to launch campaign for Covid-19-appropriate behaviour as cases spike
150,IMF quota review: Sitharaman pushes for greater coordination among BRICS nations
150,"World Health Day: Address inequities to build a healthier world, says WHO"
151,'Being world No. 1 does not mean you can score 40-ball tons every time': Malan
151,'Seems to be a mid-table team': Aakash Chopra predicts RR's future in IPL 2021
151,Full list of records CSK captain MS Dhoni can achieve in IPL 2021
151,IPL 2021: Punjab Kings - Team profile and full squad
152,Mansukh Hiran murder case: NIA to quiz DCP-rank officer
152,NIA to question DCP-rank officer in Hiran murder case
153,Tamil Nadu elections: Congress leader Karti Chidambaram cast vote in Sivaganga
154,"Akshay Kumar hospitalised after testing Covid-19 positive, shares health update"
154,Bhumi Pednekar on Covid-19 diagnosis: 'Lot harder than you think'
154,"Katrina Kaif tests positive for Covid-19, under home quarantine"
154,Milind Soman shares romantic pic with Ankita Konwar after beating Covid-19
154,Seema Pahwa under home quarantine after testing positive for coronavirus
155,"China cautions Japan ahead of Biden-Suga meet, asks to be 'objective, rational'"
156,"Economic recovery still shallow, a month's lockdown can dent GDP by 2%: Report"
156,"Oil prices rise on stronger economic outlook, US stockpile draw"
156,Punjabi University passes
156,"Sensex opens 117 points higher, Nifty above 14,700; RBI monetary policy awaited"
156,"Will bitcoin follow the mania, panic and crash trajectory?"
157,Pune residents get first robotic lockers at their complex with Godrej Group
158,Jordan bans news outlets from covering royal rift
158,Jordan's Prince Hamzah says he won't obey orders: Audio recording
158,PM Modi 'mum' on Indira Gandhi's role in creation of Bangladesh: Ashok Gehlot
158,US Supreme Court brings end to Donald Trump's 'moot' Twitter fight
159,This Twitter post about Atif Aslam’s songs translated in English is a laugh riot
160,Election promises bring no relief for stressed Tiruppur textile units
160,Elections promise no relief for Tiruppur’s stressed textile industry
161,"Bihar 10th Result 2021 Pass Percentage: BSEB Matric results out, details here"
161,Collector rates revised in Chandigarh after four years
161,"UP Board 10th, 12th exams 2021 rescheduled, to begin from May 8; check new dates"
161,"UP Board Class 10, 12 exams to begin from May 8"
162,"After French report on Rafale payment, Congress demands independent inquiry"
163,Assam records 84.96% turnout in Phase 3 of polls
163,Puducherry records 81.70% turnout in assembly polls
163,Tamil Nadu assembly election: Polling proceeds 'smoothly' with 40% voter turnout
163,"With high turnouts, polls close in Assam, Kerala, Tamil Nadu and Puducherry"
164,"Rashmika Mandanna celebrates birthday on Goodbye set, shares pic with Amitabh"
164,Robert Downey Jr's on-screen daughter shares unseen Avengers: Endgame pics
164,"Tiger Shroff completes 7 years in films, says he is still 'the same old shy guy'"
165,"Covid-19 surge: Centre rushes 50 teams to Maharashtra, Chhattisgarh and Punjab"
165,Health minister to review Covid-19 situation with heads of 11 states today
166,J&K High Court switches over to virtual hearing
167,"Andhra HC suspends elections to block, zilla parishads scheduled for Thursday"
167,HC restrains Faridkot DC from holding meet to elect Kotkapura MC chief
168,"After protests, new orders puts J&K DDC chiefs at par with mayors"
168,New order lists J&K DDC chiefs above MPs
169,Sophisticated and Splendidly Indian
170,"Masks, ventilation stop Covid-19 spread better than social distancing: Study"
171,"From Suryakumar Yadav to SKY, the tale of a transformation"
172,Fetal heartbeat monitoring best method to reduce unnecessary C-section: Study
173,16-year-old Pranav Mangal putting his ideas to improve online marketing in 2021
174,Former school teacher battles to save Indonesia's mangroves
175,Indonesia readies hospital ships for cyclone survivors
175,"Indonesia: Death toll from floods, landslides rises to 55, at least 40 missing"
175,"More than 75 dead in Indonesia, East Timor floods, dozens missing"
176,Ansari’s wife approaches SC
176,Mukhtar Ansari's wife approaches Supreme Court
177,"Bollywood’s release calendar goes for a toss, yet again"
177,Sooryavanshi release postponed indefinitely due to rise in COVID-19 cases
178,Galat video: Rubina Dilaik gets fooled in love. Watch here
178,"Hollywood's Andy Long joins Liger team for stunt choreography, Ananya rejoices"
179,Centre asks its employees of 45 years and above to get vaccinated
179,"Covid-19 surge: Harsh Vardhan to meet health ministers of 11 states, UTs"
179,Health minister says Covid-19 surge can be contained if people follow rules
179,NCW chairperson discusses police's role in women safety with Rajasthan DGP
179,News updates from HT: Health minister says follow Covid rules to contain surge
180,"BSEB declares matric results, overall 78.17% pass"
180,"BSEB declares matric results, overall 78.17% pass in Bihar Board 10th exam"
180,Bihar Board 10th Result 2021: Simultala Awasiya Vidyalaya students shine
180,Bihar board class 10 results 2021 : 101 boys and girls are top 10 rankers
181,Quad navies join France-led drills in Indian Ocean
181,Quad navies join France-led drills in Indian Ocean Region
182,IMD forecasts warmer temperatures in April
183,"IFS officer shares adorable footage of fishing cat family, wows netizens"
184,Sealed EVMs sent to college in Krishnagiri
184,Three-tier security in place at counting centres in Salem
185,How to be a fitness model: Rakesh Saini
186,"5 easy Yoga exercises to try at home and improve posture, hunchback problem"
187,"Masks mandatory even while driving alone, rules Delhi high court"
188,Padma Shri educationist Gowri Ishwaran joins leadership board of VEGA Schools
189,Autorickshaws hit despite PMPML shutdown
190,Rimi got ‘positive response’ for Munna Bhai MBBS audition but lost role to Gracy
191,Another patient flees MGMMCH Covid ward
191,"Chhattisgarh encounter | Jawan missing, may be in captivity of Maoists: CRPF DG"
191,"Days after ambush, Maoists say missing jawan in their custody"
191,"Iran: Man kills 9-year-old son, 7 other relatives before dying by suicide"
191,"Maoist attack: Search on for missing jawan, cops do not rule out abduction"
192,Lone LJP MLA joins JD(U)
192,Lone Lok Janshakti Party MLA Raj Kumar Singh joins JD(U) in Bihar
193,"Increase Covid hospitals across state, says Yogi"
193,Increasing water supply on Delhi govt agenda
194,"In new India, leveraging the country’s great mineral potential"
195,Golf | Fast conditions set to pose supreme challenge
196,Tamil Nadu: Dravidian parties face a high-pitched battle
197,Covid-19: Gujarat government orders 3 lakh Remdesivir injections
197,Moderna Covid-19 vaccine rolled out in UK for the 1st time
197,Zydus Cadila seeks regulatory approval for Covid-19 drug
198,"Pests enter homes, say residents of Vasundhara"
199,Horoscope Today: Astrological prediction for April 6
199,Horoscope Today: Astrological prediction for April 7
200,Maha curbs: Traders’ associations upset
200,"Maharashtra facing shortage of vaccine stock, many centres shut: Rajesh Tope"
201,"Pandemic, fund crunch halt Delhi parking policy implementation"
202,"Ashwin posts hilarious video with Rahane, Pant during DC photoshoot"
203,"Sutradhara’s tales: Islamic powers conquer Deccan, Sufism arrives in Pune"
204,"Partly cloudy sky likely in Delhi today, air quality to deteriorate further"
204,"Partly cloudy sky likely in Delhi today, air worsens"
205,Phase 3 of Bengal elections: 5 prominent candidates to keep an eye out for
205,"Polling to take place in Kerala on Tuesday; UDF, LDF, NDA in triangular contest"
205,"TMC bastions, big names in Phase 3 of West Bengal elections"
206,Apply for HSRP online
207,390 new Covid cases take Ludhiana’s count past 36K
207,"Amid Covid surge, eight more patients die in Punjab’s Mohali"
207,"Ludhiana sees 5 more Covid deaths, toll reaches 1,182"
207,"Punjab records 72 Covid deaths in a day, highest this year"
208,Himachal fighting forest fires after prolonged dry spell
208,Lack of strategy impedes fight against forest fires
208,Smoke from fires in Uttarakhand worsens Delhi’s air quality
209,Centre opens up Covid-19 vaccination at work places from April 11
209,Govt may soon organise Covid-19 vaccination sessions at workplaces
210,Ursula von der Leyen taken aback as Erdogan and her colleague snap up the chairs
211,"Allow citizens above 25 to get Covid jab, Maharashtra CM requests PM Modi"
211,"Allow citizens above 25 to get vax, CM requests PM"
211,Uddhav Thackeray urges PM Modi to lower the age bar for Covid vaccine to 25
212,"Pune artistes change professions to cope with, and survive lockdown uncertainties"
213,May shoot down Chinese drones in South China Sea: Taiwan
213,Taiwan will fight ''to the very last day'' if China attacks
214,"4th Delhi Contemporary Art Week to feature 7 galleries, over 70 artists"
215,"Barcelona nets late winner, cuts Atletico's lead to 1 point"
215,Foden outshines Haaland to give City 2-1 lead over Dortmund in CL quarter
215,Liverpool will have a chance when Real come to a 'proper stadium'
215,"Manchester United's Rashford available for Granada clash, says Solskjaer"
215,Real Madrid beat Liverpool 3-1 in 1st leg of CL quarterfinals
215,Renewed Real complete transformation by blowing Liverpool away
215,"West Ham into the EPL's top 4 despite Antonio, Rice injuries"
216,'Don't think he needs much help': Ponting on new DC captain Pant
216,"IPL 2021: MI all-rounder Pollard finishes 7-day quarantine, ready to train"
216,KKR spinner Pawan Negi fine-tunes skills under 'watchful' eyes of Harbhajan
216,PM to inaugurate vessel for Seychelles
216,Pujara receives official kit from MS Dhoni as CSK welcome new recruits
216,Will Pant lead DC to their maiden IPL title? Kapil Dev gives fascinating answer
217,8 warning signs that your lifestyle has put you at risk of diabetes
218,Diversify your portfolio with contactless Bajaj Finance online FD
219,Arhtiyas won’t procure wheat if DBT payment mode not withdrawn
219,"Favour DBT, but Centre should defer it this wheat season: BKU (Ugrahan)"
220,India’s ‘double mutant’ Covid strain found in US
220,India’s ‘double mutant’ Covid-19 variant detected in US
221,Here's how harmful chemicals in plastic up risk of postpartum depression
222,IPL 2021: 5 lowest team totals in IPL history
222,T20 World Cup in India on track despite pandemic woes: ICC
223,Dotlines CTO Eftekhar builds the first-ever DIY productivity & security solution
224,2 dead as oil tanker falls into gorge in Jammu and Kashmir's Reasi district
224,"Workers inhale toxic gas while cleaning septic tank, two dead, one critical"
225,'We don't wear a mask': Details from secret dinner parties in Paris amid Covid
225,France: Ministers accused of dining at secret restaurants
226,"'Leg broken, but still fighting': Jaya Bachchan campaigns for Mamata Banerjee"
226,"Bengal Polls: PM Modi targets Mamata over appeal to Muslim voters, CM hits back"
226,"Mamata Banerjee's appeal to Muslims violated model code of conduct, says EC"
226,"PM Modi holds rally in Howrah, asks people to vote for the ‘lotus’"
227,"In election season, the raids are back—against Opposition leaders"
227,"In state elections, decoding the PM’s campaign and his key messages"
228,"Hima, Dutee named in 4x100m relay team for World Athletics Relays"
228,"Mary Kom, Lovlina in Indian women's boxing squad for Asian Championships"
228,Nethra Kumanan becomes first Indian woman sailor to qualify for Olympics
229,Jeegar Chauhan's inspiring journey from an outsider to mainstream producer
230,Don’t give Oxford/AstraZeneca vaccine to under-30s: U.K.
230,UK to offer non-AstraZeneca Covid-19 vaccine to under-30s over blood clot link
230,WHO does not back vaccination passports for now: Spokeswoman
231,Friends App's community-driven approach brings in a better social experience
232,"San Francisco school board to vote on school renaming, again"
233,Bengaluru and other Karnataka districts where Covid-19 is wreaking havoc
233,Bihar tourism dept cancels all its April events amid rise in Covid cases
233,"Fearing second wave, Bihar tourism dept cancels all mega events"
234,Facebook says data on 530 million users 'scraped' before September 2019
235,Rakhi Sawant says she will pray for Vicky Kaushal after his Covid-19 diagnosis
236,How to prevent food-borne illnesses
237,"Cable work, manual traffic management results in 4-km traffic snarl on Dwarka Link Road"
237,Commuters troubled as part of CISF Road overflooded due to water pipeline damage
238,AI can bring enormous changes in way we train and fight wars: IAF chief
238,"China capable of launching cyber-attacks against India, says CDS Gen Rawat"
239,Harvard study praises UP Govt for its handling of migrant crisis during pandemic
240,A timeline of Australia's Covid-19 vaccine plan mired in European back-and-forth
240,Australia short of 3 million AstraZeneca Covid-19 vaccine doses
241,India beat Argentina 4-3 for winning start to tour
241,India face Olympic hockey champions Argentina in FIH Pro League restart
241,We're looking at Argentina tour to build momentum ahead of Olympics: Harmanpreet
242,Army chief visits Defence Services Staff College in Tamil Nadu's Wellington
243,"BJP categorises Bengal constituencies, says Nandigram not ‘a tough contest’"
243,BJP internal assessment: Nandigram a contest
244,Cookbook author Chrissy Teigen reveals she's done with dieting
245,Levitating with the next big thing: Udit Sehgal
246,"After death, some cells in human brain remain active: Report"
247,Why do we pick problematic partners?
248,"In two months, 10 stranded leopard cubs reunited with mothers in Junnar"
249,'BTS Army was brave enough to support my vulnerable moment': John Cena
250,Accelerate inoculation drive in India first before sending vaccines outside: AAP
250,"State, Centre disagree over oxygen supply guidelines"
251,'Was cornered in TMC for resisting cut money culture...': Rajib Banerjee
251,"Centre trying to dominate with farm laws, DBT: Punjab CM"
252,Dilip Walse Patil gets charge of Maharashtra home dept
