0,Best buy under
253,IPL 2021: Full list of records & milestones Virat Kohli can reach this season
254,Study suggests risk of leukemia higher in children with Down syndrome
255,"India could resume vaccine exports by June, says SII CEO Adar Poonawalla"
256,Mandela movie review: The only film you need to watch before the next election
257,"Sanju Samson interview: 'Got texts from Kohli, Dhoni after becoming RR captain'"
258,HC seeks vigilance response on plea alleging scam in medicine purchase
259,Dr. Shankar Iyer advocates smiling every day to live longer
260,IMF projects India's growth rate to jump to 12.5 per cent in 2021
260,"IMF raises China's 2021 growth forecast to 8.4%, marking 10-year high"
261,"Allu Arjun spends son's birthday in Maldives, turns photographer for daughter"
262,"Small cruises are thriving, not just surviving, on the Mississippi"
263,The power of the female form gets depicted in art
264,"Chelsea's Rudiger, Kepa involved in training bust-up: Report"
264,Valencia told to play on after walk-off over alleged racist insult: Gaya
265,Emergency vehicles to be allowed in revamped Chandni Chowk stretch: Jain
265,Lockdown in Madhya Pradesh's Chhindwara after Covid-19 cases spike
265,Lockdown in Raipur district from April 9 to 19 as Covid-19 cases surge
266,TV fame Anupriya Parmar shooting her way through acting skill in Dhollywood
267,"DU student sheds weight, inspires peers to be body positive"
268,"Only 11% people say compliance to social distancing norms, masks is good: Survey"
269,India looks to counter OPEC+ with new links
270,"In Tamil Nadu, two first-timers fight to preserve party legacies"
271,This fluffy and tiny animal is Twitter’s new love. Can you identify it?
272,"Zeishan Quadri: The film industry was, is, and will remain biased"
273,Don’t know if we’re ready for Asian Champions League: FC Goa coach Juan Ferrando
273,"Small-businesses, gym owners stare at losses during month-long restrictions"
274,"Karnataka bus strike from today, public transport likely to be affected"
274,"Karnataka govt rules out negotiations with RTC workers, warns against strike"
274,"Maharashtra Covid curbs: Discussions were held, says Raut as protests surface"
274,"RTC strike: Decision on invoking ESMA depending on situation, says Karnataka CM"
274,Strike total as buses go off the road in Mysuru
275,Mulshi: Activists arrange free buses for villagers to take the jab
276,"Meghan Markle, Prince Harry reveal first Netflix docuseries 'Heart of Invictus'"
276,"Prince Harry, wife Meghan's first Netflix project to focus on Invictus Games"
277,Maldives is Indians’ new favourite holiday destination during the pandemic
278,"After HC rap, Panjab University announces senate poll schedule"
278,CM orders speeding up redesigning of major arterial roads
278,Panchayat polls: BJP releases second list
279,"European medicine agency says AZ Covid vaccine, rare blood clots in brain linked"
280,"78.5 lakh voters, 205 candidates: West Bengal all set for phase 3 of polling"
280,Assam set for final phase of polls on Tuesday in 40 assembly seats
280,"Assam: Alliances, independents set to make 3rd phase the most closely contested"
280,Assam: Voting for final phase of polls begins; high voter turnout expected
280,Bengal polls: 205 candidates will fight it out at 31 seats in third phase
280,Stage set for final phase of polls; voters hold the key
281,US Supreme Court sides with Google in copyright fight with Oracle
282,1 more Maharashtra min will resign in 8 days: State BJP chief
282,Maharashtra BJP chief says one more MVA minister will resign in 8 days
283,IPL 2021: Who is RR's Jos Buttler's 'cute' workout companion? - WATCH
283,"Ludhiana nonagenarian shows the way, urges others to take the jab"
284,Over 30-year-old Noida Golf Course boundary wall gets a makeover
285,Study reveals low glucose levels might assist muscle repair
286,Jailed Harvey Weinstein appeals sex crimes conviction
287,Violation of Covid-19 curbs: Govt seeks explanation from Tarn Taran civil surgeon over Holi bash
288,"Italy to allow fans at Euros, some other hosts yet to decide"
288,"Spain, Netherlands plan for fans at European Championship"
289,IIT Guwahati team develops technique to boost performance of lithium ion battery
290,Facebook removes accounts tied to Iranian exile group
291,Assam University students’ demand for online examination rejected
291,IIT-Guwahati suspends student accused of raping batch mate; puts 4 in isolation
291,"State board begins offline practical exams for Class 10,12"
292,SNDP moots works worth ₹858 cr.
293,Certain high BP medications may alter heart risk in people with HIV: Study
294,"MCG to introduce 2,000 e-rickshaws, will hold meeting with owners of diesel autos"
294,"RTA announces subsidies, scrap costs to replace old diesel autos with e-rickshaws"
295,Right To Protein invites all to join Global Soy Month in April 2021
296,Diary of a Wimpy Kid author Jeff Kinney's new book inspired by scary times
297,"Phase 3: TMC, BJP continue to accuse each other of polling malpractices"
297,‘Misuse of forces’: Mamata rages again as Phase 3 polling underway in Bengal
298,Next round of military talks on LAC row likely on April 9
298,"Post Quad summit, India-China military talks on LAC friction possible on April 9"
299,Woman’s swift dress change during performance stuns netizens. Watch
300,"Admin issues protocols to RWAs and malls, asks residents to work from home"
300,Lucknow University tightens COVID-19 restrictions
300,RWAs promise all help to authorities as Covid night curfew begins
300,"Students and parents in Maharashtra ‘storm’ Twitter against offline SSC, HSC exams"
300,‘Maharashtrians face the brunt’: Raj Thackeray blames migrants for Covid-19 surge
301,"As cases surge, officials told to keep close watch on 4 Valley dists"
302,4 cops injured in Bihar as students’ stir turns violent
302,"Civil defence volunteers, civilians clash after car crash, cases filed"
302,Mob attacks couple inside Odisha police station
302,Parents’ protest over school fee spells trouble for Ludhiana commuters
302,Sambalpur univ students go on rampage demanding online semester exam
303,Covid-19: Noida admin asks residents to inform it about arrival of outsiders
304,Explained: Minneapolis chief seeks to reform police department
304,Minneapolis police chief testifies Chauvin violated policy in Floyd arrest
305,Florida evacuations order lifted as danger from leaky wastewater reservoir fades
306,Abducted Bihar man freed by ULFA on Myanmar border
306,Bihar man abducted by ULFA-I from Arunachal released after 105 days
307,Bangkok closes 196 entertainment venues for two weeks amid new Covid-19 cluster
307,Second wave of bird flu kills hundred birds in Himachal Pradesh
307,"Several states, UTs close schools or suspend classes due to rise in COVID19 case"
307,"UK's Glastonbury Festival, cinemas, museums get government cash to survive Covid"
307,Ukraine’s Kyiv tightens Covid-19 lockdown as coronavirus infections spike
308,"'I used to bowl a lot,' KKR's Shubman Gill reveals why he stopped bowling"
308,ICC rankings: Fakhar Zaman gains big after 193-run knock against South Africa
308,"SA vs PAK, 3rd ODI: Pakistan wins series in South Africa with another Fakhar 100"
308,"South Africa vs Pakistan, 3rd ODI Highlights"
309,Army recovers explosives near LoC in J&K’s Tanghdar
309,Bomb scare: Mock drill outside National Media Centre in Delhi
310,Females in pain not taken as seriously as male patients: Study
311,"Man accidentally steps on loose piece of wood, gets smacked on face"
311,‘Not funny Kevin!’: Human’s prank on doggo leaves it bamboozled
312,Chhattisgarh ambush: Missing Jammu jawan’s wife appeals Naxals to release him
312,Protests in Jammu seeking release of CRPF commando in Maoists captivity
313,"IPL 2021: Nortje, Rabada arrive in Mumbai to join DC squad"
313,"IPL 2021: Rabada, Nortje on their way to link up with DC squad in Mumbai"
314,Calls grow for fee waiver for EWS students till class 12
315,Vandals damage famous Norwegian baby statue in Oslo park
316,"Centre seeks listing of Isro spy case on Kerala poll eve, SC sees no urgency"
316,French investigator shelved graft probe into Rafale jet deal: Report
316,Key witness in George Floyd murder trial seeks to avoid testifying
316,SC stays trial against Yediyurappa in ‘illegal’ land denotification case
317,Video showing woman’s underwater gymnastics is oddly satisfying to watch
318,News updates from HT: Delhi govt urges people to wear masks amid 4th wave
318,"Wear masks, appeals Delhi govt as city sees ‘fourth wave’ of Covid-19 pandemic"
319,Google’s advisory doodle asks people to stay safe and wear masks
320,"55,469 new Covid-19 cases reported in Maharashtra"
320,Active caseload rising; 550 new cases in Kozhikode
320,"Covid-19: Maharashtra records over 50k new cases, 297 fresh deaths"
320,"Delhi records 3,548 new Covid-19 cases, over 3,000 containment zones created"
320,"Delhi's daily Covid-19 caseload records another spike, crosses 5,000-mark"
320,"Maharashtra daily cases surge past 50k again, death toll inches towards 57,000"
320,"Maharashtra's daily Covid-19 caseload dips by 10,000, Mumbai's tally down too"
320,"Mumbai records 9,879 new cases, 21 deaths"
321,International NGO advocates a forum for peace dialogue by stakeholders
322,RBI doubles payments bank balance limit to
323,Giving powers to housing society heads to tackle Covid gets mixed response in Pune
323,Minister rules out lock-down or night curfew
323,"Situation in neighbouring Maharashtra, Karnataka being monitored: Goa CM"
323,US says 'won't comment' on Pakistan's move against importing sugar from India
324,Pandemic effect: Hola Mohalla donations at Anandpur Sahib gurdwaras dip this year again
325,Climate change shrinks marine life richness near equator: Study
326,Pradyot Singh Rathore & Shahrukh Pathan launch Spartans Cricket Academy
327,₹585.53 cr. from KIIFB to NHAI
328,Recipe: Say ‘goodbye’ to stress with these chocolate covered frozen raspberries
329,"Andhra cop takes care of one-month-old baby as mother casts vote, garners praise"
330,Rupali Ganguly: Aisa birthday yaadgar rahega
331,"From 1980 to 2021, the BJP’s journey"
332,Why don’t voters value health care?
333,Lend the warmth of your heart to keep strays cool this summer
334,"Thailand households struggle with record debt, Covid-19 increases burden"
335,"Ajay Devgn ensured I got the best treatment, press called me 'scarface': Mahima"
335,Jayati wonders if her mom's vaccination was cancelled due to vaccine shortage
335,Kajol says 'my eyes aren't even black' in this vintage BTS video from Baazigar
335,Mahima Chaudhry reveals she had two miscarriages during her troubled marriage
335,"Mahima says she was replaced in RGV's Satya, learned about it from the press"
335,Ram Gopal Varma says he might make a film on Sushant Singh Rajput
336,Training opens 'a window of hope' for Albanian rug-weavers
337,Ludhiana factory roof collapse witnesses recount horror
338,Sputnik maker ties up with Indian firm to produce 100 mn doses
339,"Experts see no link between Punjab Covid-19 surge, farm protest gatherings"
340,Air India Boeing pilots seek urgent meeting with aviation minister over pay cut
341,"Animal cruelty cases rose in Mumbai since lockdown, claim activists"
341,"Deterred from harassing women, two miscreants assault, rob Good Samaritan"
341,"Gzb:18-year-old woman stabbed multiple times, thrown into Upper Ganga Canal"
341,Man wanted in 39 criminal cases arrested after brief encounter with police
341,Two held with 4.7kg stolen gold jewellery in Mohali
342,Filmmaker Shafeeq Rahman celebrates 12th royal wedding anniversary
343,Gold prices fall further today. Check rates in your city here
343,"Gold prices fall today, a day after increase. Check rates in your city here"
344,Delay in UP RERA court’s orders aggravating homebuyers’ problems
345,Tiger Shroff flaunts washboard abs in new beach photo. Here's how he keeps fit
346,Civils interview from April 26
346,US airlines bringing back more pilots as travel demand rebounds
346,United Airlines seeks to build its own diverse pipeline of pilots
347,"'Mukhtar Ansari was given poison in same Banda jail', says his brother"
348,Covid-19: Five questions about vaccination
349,BKU leader Rakesh Tikait threatens tractor agitation in Gujarat after Delhi
349,"Farmers hold protests outside FCI offices in Rohtak, Karnal"
349,"Haryana BJP MP Nayab Saini’s SUV blocked by farmers, windshield broken"
350,'I was just hitting him for sixes': Hetmyer on facing India bowler in DC nets
350,IPL 2021 | Reigning behemoth MI primed to crush all comers
350,IPL 2021: Delhi Capitals - Team profile and full squad
350,IPL 2021: Mumbai Indians - Team profile and full squad
350,IPL 2021: Sunrisers Hyderabad all-rounder Jason Holder arrives in Chennai
350,Pant looking to ‘do something different’ in first game against Dhoni's CSK
350,Parthiv Patel wants MI to achieve 'biggest record' in IPL history
350,Robin Uthappa presented IIM-K National Excellence Award
351,"COVID passports, travel traffic lights in Boris Johnson's unlock plan for UK"
351,UK to move to 'phase two' of roadmap to exit Covid-19 lockdown
352,White House press briefing gets surprise visit from Easter Bunny
353,NASA's Ingenuity helicopter survives first night alone on Mars
354,'He is not your gun death bowler': Chopra explains how KKR should use Cummins
354,"'No, I'm not batting': Ponting on when Shaw refused to bat in DC nets"
354,"'Very disappointing, hasn't succeeded in IPL': Gambhir on RCB's"
355,Doctors flag early lung infections as new Covid-19 concern
355,Early lung infections new Covid concern
355,"Explained: African Swine Fever, suspected, after over 80 pigs die in Mizoram"
356,"Assembly Poll Highlights: Voting ends in phase 3, high voter turnout recorded"
356,Assembly elections: The biggest phase of them all...
356,"Impressive voter turnout in high-stakes assembly elections, highest in Assam"
356,"Single-phase Puducherry election on Tuesday, voting to be held on 30 seats"
356,Voting in 475 seats across 5 states: Biggest day of elections cycle today
357,WHO confirms possibility of Covid-19 transmission from humans to animals
358,Time to clean up Mumbai
359,"‘Not so fast!’: Insect fails to escape Venus flytrap, video is oddly satisfying"
360,Sanjay Suri on turning 50: I am loving this phase of my life
361,Kartik Aaryan buys brand new Lamborghini Urus after Covid recovery
361,"Kartik Aaryan touches his new car's 'feet', watch video"
362,"No scarcity of liquid oxygen: Rao; 12,000 Remdesivir injections will be available by Wed"
363,US President Biden likely to name Evercore’s Bianchi as trade deputy
364,"Covid spell, spells bad days for Bollywood- again?"
364,FALSE: No truth to 45 people from Akshay Kumar’s Ram Setu crew testing Covid positive
364,Former India wicketkeeper and MI scout Kiran More tests positive for Covid-19
364,IPL’s home test amid rising cases
365,Vishu handloom expo till April 13
366,Kishwer responds to Kangana's fans who accuse her of 'bullying' actor
366,Varun and Natasha donate
367,"42 shops, 3 owners: Tip of iceberg of Delhi liquor cartels, say officials"
368,'Centre replenishes more Covid-19 vaccine than needed': Javadekar
368,"'No vaccine shortage, attempts by state govts to spread panic': Harsh Vardhan"
368,News updates from HT: Union health minister denies Covid-19 vaccine shortage
369,"Shweta Tripathi Sharma: Covid ke baad, body ki band baj jati hai"
370,Recode Studios: An E-commerce platform bringing cosmetics at your doorstep
371,Heart patients three times more likely to have diabetes: Study
372,"CBSE signs MoU with AICTE to enhance skills of teachers, students"
373,DIGILIVE celebrates Women’s Month with its Special Achievement Awards
374,"Manipur probe almost over, allow SIT officers to do other work: CBI to SC"
374,Supreme Court order on release of Rohingyas detained in Jammu on Thursday
375,Rural administration adopts early detection and case management policy
376,Citizens’ committee to keep an eye on Jalpura animal shelter
377,"Actor Vijay cycles his way to the polling booth, watch"
378,Osaka requests cancellation of torch relay leg
378,Tokyo Olympic torch relay taken off streets of Osaka
379,"News updates from HT: Video claims 50,000 Covid-19 deaths in India, WHO denies"
379,"Video claims 50,000 Covid-19 deaths in India by April 15, WHO says it's fake"
380,"Centre seeks urgent hearing in ISRO espionage case, SC to hear matter next week"
380,Consider meet on CBI chief before May 2: SC
380,Kumbh might become Covid-19 'super spreader': Central govt official
381,"Punjab sets up 3,700 mandis for procuring wheat amid Covid surge"
382,Biden's economic plan gets boost from Senate procedural ruling
382,White House aims to create legal ways for Central Americans to migrate: US envoy
383,"Shikha Pandey breaks into top 10 bowlers; Mandhana, Mithali retain spots"
384,IIT Mandi researchers develop algorithm to optimise vehicle’s fuel efficiency
385,"Mobisafar partners with YES Bank, NPCI to launch Virtual RuPay Prepaid Card"
386,VC appointed for TN Veterinary and Animal Sciences varsity
387,"Sensex closes at 49,201, Nifty up 45 points at 14,683"
388,"Anil Deshmukh out, BJP’s Ravi Shankar Prasad aims next at Uddhav Thackeray"
388,News updates from HT: BJP says Maha CM lost moral responsibility to govern
389,One killed as speeding SUV rams into cycle in Noida
389,Pedestrian killed by container in Jambhulwadi
389,"SUV rams e-rickshaw, two injured"
389,"‘Distracted’ while driving, woman runs over elderly couple in Dwarka"
390,"Leaders of Russia and China tighten their grips, grow closer"
391,"Kriti Sanon: Hoping things normalise soon, so many films are pending to release"
392,"In a first, UP to transform five jails into high-security prisons by 2023"
393,'Pariksha Pe Charcha' to be held virtually on April 7
393,"'Pariksha Pe Charcha' will be exciting interaction, says Prime Minister Modi"
393,Join fourth edition of 'Pariksha Par Charcha' with PM Modi tomorrow
393,PM Modi's 'Pariksha Pe Charcha' to be held today
393,"Pariksha Pe Charcha 2021 highlights: Study hard and play hard, PM to students"
393,Sisodia launches DTU's 'Lab on Wheels' programme to teach govt school students
394,SGPC writes to Twitter CEO to block hateful tweets against Sikhs
395,Cryptocurrency market cap hits record $2 trillion; Bitcoin's at $1.1 trillion
395,"Sensex climbs 300 points after RBI policy outcome; Nifty jumps over 14,750 level"
395,"Sensex closes 460 points higher at 49,661, Nifty above 14,800"
395,"Sensex rebounds over 300 points after opening in red, Nifty up by over 99 points"
396,"E-commerce giant to set up fulfilment centre in Haryana’s Manesar, to be one of its largest centres in Asia"
396,Flyover to decongest Narela-Bawana opens
397,"'Weddings, farm stir, polls causing surge in Covid cases': Health minister"
397,"Covid-19: Centre says Maharashtra, Punjab, Chhattisgarh cause of maximum concern"
397,Second wave of Covid may pick pace in Haryana due to congregations
398,181 votes cast in polling station with 90 voters; 5 officials suspended
398,"In Assam's Dima Hasao, 171 votes cast at booth that has 90 eligible voters"
399,"Private car is a public place, masks mandatory even when driving alone: Delhi HC"
400,"SGPC employee’s killing: Daughter’s stalker, aide held; pistol used in crime recovered"
400,Stepfather arrested in Kerala for murder of girl
400,Yerawada police solve two-year-old murder case
400,Youth Cong leader murder: Gangster Bishnoi aide nabbed from Kasol in HP
401,"Covid-19: Bihar witnesses spike in cases, Patna emerges as hotspot"
401,India records highest single-day Covid-19 vaccine coverage yet
401,"Over 10,000 new Covid cases in Mumbai again; Maharashtra tally up by nearly 60K"
401,Poll-bound Tamil Nadu records over 3000 cases of Covid-19
401,"Slight dip in new Covid-19 cases in India after crossing 100,000 mark"
401,State logs over 1k cases for first time this year; Ranchi positivity rate at 18%
401,"Tamil Nadu reports close to 4,000 new Covid-19 infections"
401,"Telangana, Andhra see spike in Covid-19 infections; positive cases cross 1,000"
401,"UP’s Monday figures: 3999 fresh cases, 13 deaths"
402,JEE Main April 2021 correction window last date extended
402,"NEET PG 2021: Application correction deadline extended, check details"
403,Adah Sharma: I am getting really good roles only now
404,Alia Bhatt finds strength in motivational quote as she recovers from Covid-19
404,Alia Bhatt shares cute photo as she recovers from Covid-19 ‘one day at a time’
404,"Janhvi goes on 'shaahi sawari' inside airport with her mask, face shield on"
404,"Kangana Ranaut spotted at a dubbing studio without a mask, Suyyash Rai reacts"
405,"Japanese scriptwriter Sugako Hashida, famous for hit drama 'Oshin,' dies at 95"
406,First Covid-19 vaccine shot alone not protective: Chile study
407,Covid-19 forces business owner to move from mandaps to mobile mandaps
408,Cyble appoints former IBM executive Ruchir Verma to scale operations
409,"Healthy diet, exercise might be key to achieving optimal health in later years"
410,"3,050 containment zones in Lucknow, Indira Nagar tops list with 400"
411,Inaaya plays with grandmom Sharmila as Soha looks on in new pic shared by Saba
411,Mira Kapoor throws back to stunning look in
412,China condemns 2 ex-Xinjiang officials on separatism charges
413,"Afghanistan food festival held in Hyderabad, aims to promote culture, trade"
414,"3 killed, 7 injured as roof of factory collapses in Ludhiana"
414,"Day after roof collapse, Ludhiana MC recommends FIR against lintel lifting"
414,Ludhiana factory roof collapse kills 4; 7 injured
415,Japanese internment art auction stopped after protest
416,"To make India Vishwa Guru, collective efforts needed: RSS chief Mohan Bhagwat"
417,Malaika Arora reveals her 3 favourite Yoga asanas for toning the body | Watch
418,Summer bride embraces the age-old ghoonghat 
419,"Children suffering from inflammatory illness had mild Covid, shows new study"
420,KKR has one of the best ‘spin departments’ in IPL 2021: Kuldeep Yadav
420,‘You have to bite the bullet’: Ganguly remembers biggest setback of career
421,"'If so, then it's Not out': MCC explains law after Zaman's controversial run-out"
421,"'Spirit of the game was hurt, de Kock shouldn’t do it deliberately': Akhtar"
421,'Thought I deserved a hundred': Gill recalls Gabba 91 against Australia
421,'We were praying for Fakhar Zaman to get double hundred': Babar Azam
421,Coventry thanks Markram as Fakhar Zaman fails to break Zimbabwe batsman's record
421,Full list of records & milestones Hardik Pandya can achieve in IPL 2021
422,"'He’s an institution, there'll will be so much to learn from him'"
422,"Chopra picks ideal RCB XI for IPL 2021, leaves out 2 prominent Australians"
422,"Pant plays ‘box cricket’ with Ashwin, Rahane; Gill gets special mention: WATCH"
422,Prithvi Shaw reveals how Ricky Ponting's speeches remind him of Shahrukh Khan
423,391 ‘black spots’ identified on roads in 12 Punjab districts
424,"Waste to art: Imitations of Sarnath Stupa, Taj Mahal and Ganga ghat installed at Mahamaya Flyover in Noida"
425,"Govt urges people to quit smoking, says increases vulnerability to Covid-19"
426,Norwegian Cruises seeks permission from CDC to allow trips from US in July
427,Young man who crossed LoC near Kupwara handed over to Pakistani Army
428,"'Left will be shown its place, UDF poised for comfortable win': Shashi Tharoor"
428,MP Jaya Bachchan in Bengal to campaign for ruling TMC
428,"Mission 2022: Akhilesh criss-crosses state, covers 40 districts"
428,"Tejashwi campaigns for Trinamool in Bengal, fields party veterans too"
429,Nora Fatehi paints the town red in bodycon dress with bag worth
430,Joji movie review: Top-rate crime thriller headlined by a terrific Fahadh Faasil
431,Ambulance used by Mukhtar to be brought to UP’s Barabanki from Punjab
431,Antilia explosives scare- Mansukh Hiran death case: NIA recreates crime scene at Mumbai station
431,"Barabanki police seize ambulance, get tech examination done"
432,Recipe: Spruce up your week day meal with these easy to make Mexican enchiladas
433,Rahul Vaidya and Disha Parmar dress up in wedding finery but there is a twist
434,22-year-old UP man self-immolates after woman refuses to meet him
434,"Couple die by suicide inside Paharganj hotel, leave note behind"
434,‘Glad we took it’: Odisha couple urges others to dispel rumours about vaccine
435,Suhel Vats' Big Muscles Nutrition created a million-dollar opportunity in India
436,People have to ensure there is no Covid-19 '3rd wave': CSIR DG
437,Covid-19: MP chief minister says not wearing masks amounts to 'crime'
437,Nitish Kumar chairs high level meeting to review Covid-19 situation in Bihar
437,"Patna schools revert to online classes for new session, some are upset"
437,"With spike in cases, state government ropes in special teams for Ghaziabad, GB Nagar"
438,Public banks prop up Jan Dhan as pvt lenders falter
439,"After Akshay, 45 incoming crew members of Ram Setu test positive for Covid-19"
440,Dia Mirza clarifies she didn’t marry Vaibhav Rekhi because she was pregnant
440,Did Randhir Kapoor share and delete pics of Kareena-Saif's newborn son?
440,Kareena Kapoor Khan says she needs a tan. Here's how Bebo takes care of her skin
441,Rise in testing count delays RT-PCR reports by up to 36 hours leading to possible spread of infection in Pune
442,No plan to end Kumbh Mela despite rise in Covid-19 cases
